id,first_name,last_name,email,gender,ip_address,address
747,Julieta,Pymar,jpymarkq@nyu.edu,Female,94.165.175.253,Mitchell Shawnee Mission Kansas United States
748,Salvatore,Reddie,sreddiekr@sakura.ne.jp,Male,175.186.238.214,Bonner Tallahassee Florida United States
749,Suzanna,Shiliton,sshilitonks@zimbio.com,Female,23.125.44.100,Northfield New Haven Connecticut United States
750,Zack,Rubinsztein,zrubinszteinkt@icio.us,Male,174.148.49.207,Lindbergh Des Moines Iowa United States
751,Ashlan,Newvell,anewvellku@printfriendly.com,Female,95.191.147.220,Lakeland Corpus Christi Texas United States
752,Cesar,Beetlestone,cbeetlestonekv@icq.com,Male,190.139.168.54,Kedzie Rochester Minnesota United States
753,Philbert,Sharper,psharperkw@cnet.com,Male,158.47.18.215,Forster Shreveport Louisiana United States
754,Rudyard,Lambe,rlambekx@opensource.org,Male,240.159.91.54,Park Meadow Modesto California United States
755,Yehudit,Constable,yconstableky@answers.com,Male,9.38.134.2,Graceland Phoenix Arizona United States
756,Carol,Willwood,cwillwoodkz@boston.com,Female,204.159.192.5,Buhler Lexington Kentucky United States
757,Meier,Copplestone,mcopplestonel0@shareasale.com,Male,23.108.206.0,Twin Pines Alexandria Virginia United States
758,Hugo,A'Barrow,habarrowl1@cbc.ca,Male,12.211.25.220,Buhler San Diego California United States
759,Chandra,Catterell,ccatterelll2@zdnet.com,Female,239.39.115.157,Talmadge Sunnyvale California United States
760,Phyllida,Bertson,pbertsonl3@discuz.net,Female,75.221.173.12,Sheridan Birmingham Alabama United States
761,Andree,Grent,agrentl4@mashable.com,Female,176.20.230.112,Mosinee Washington District of Columbia United States
762,Hieronymus,Kynder,hkynderl5@aboutads.info,Male,61.65.45.152,Comanche Dallas Texas United States
763,Christabella,Drepp,cdreppl6@vk.com,Female,223.233.96.198,Onsgard Portland Oregon United States
764,Annis,Leele,aleelel7@joomla.org,Female,208.109.127.250,Esch Richmond Virginia United States
765,Godiva,Langhor,glanghorl8@yale.edu,Female,201.55.76.246,Bluejay San Antonio Texas United States
766,Christi,Owthwaite,cowthwaitel9@eventbrite.com,Female,60.174.218.210,Hagan Naples Florida United States
767,Janith,Whitehurst,jwhitehurstla@patch.com,Female,108.204.34.27,Atwood Norfolk Virginia United States
768,Chance,Trime,ctrimelb@omniture.com,Male,191.168.58.174,Starling Brea California United States
769,Alina,McKenna,amckennalc@lulu.com,Female,121.168.108.38,Maple Houston Texas United States
770,Vera,Bragginton,vbraggintonld@newsvine.com,Female,26.109.47.27,Maple Wood Carlsbad California United States
771,Nealson,Werrit,nwerritle@engadget.com,Male,103.223.143.80,Westridge San Jose California United States
772,Madelina,Grimwade,mgrimwadelf@shinystat.com,Female,193.32.156.12,3rd Saint Louis Missouri United States
773,Fran,Ligertwood,fligertwoodlg@time.com,Male,200.67.146.208,Tony Springfield Illinois United States
774,Bat,Kienlein,bkienleinlh@vimeo.com,Male,237.110.251.217,Judy Houston Texas United States
775,Moore,Mainland,mmainlandli@histats.com,Male,154.29.120.69,Service Huntington West Virginia United States
776,Cyrillus,Degue,cdeguelj@state.tx.us,Male,36.165.6.186,Bashford Salt Lake City Utah United States
777,Gerome,McCrudden,gmccruddenlk@biglobe.ne.jp,Male,224.147.128.102,Hintze Minneapolis Minnesota United States
778,Adi,Epple,aepplell@fda.gov,Female,237.242.88.96,Columbus Madison Wisconsin United States
779,Colby,Painswick,cpainswicklm@cnbc.com,Male,59.76.36.31,Blackbird Decatur Georgia United States
780,Rosalie,Dalrymple,rdalrympleln@privacy.gov.au,Female,57.82.28.191,Sunnyside Oklahoma City Oklahoma United States
781,Garwin,Tweedy,gtweedylo@nature.com,Male,182.64.250.69,Portage Reading Pennsylvania United States
782,Ron,Terrelly,rterrellylp@surveymonkey.com,Male,163.196.37.117,Buena Vista San Diego California United States
783,Gian,Spelman,gspelmanlq@soundcloud.com,Male,217.234.50.136,Everett Minneapolis Minnesota United States
784,Todd,Tullis,ttullislr@icio.us,Male,91.191.246.128,Warner Savannah Georgia United States
785,Shell,Berrie,sberriels@merriam-webster.com,Male,188.59.236.100,Nevada Las Vegas Nevada United States
786,Valdemar,Leakner,vleaknerlt@digg.com,Male,82.77.86.79,Manley Little Rock Arkansas United States
787,Miguelita,Davidesco,mdavidescolu@nih.gov,Female,240.29.94.230,Calypso West Palm Beach Florida United States
788,Miller,Forbear,mforbearlv@google.com.au,Male,89.81.63.13,Sage Austin Texas United States
789,Kara-lynn,Keymer,kkeymerlw@lulu.com,Female,117.178.208.212,Forster Midland Texas United States
790,Winslow,Borge,wborgelx@hugedomains.com,Male,113.55.11.223,Jackson Charlotte North Carolina United States
791,Sheffie,Snoddon,ssnoddonly@infoseek.co.jp,Male,182.157.97.45,Corry Santa Fe New Mexico United States
792,Sheeree,Melin,smelinlz@netscape.com,Female,25.152.237.21,Oak Valley Seattle Washington United States
793,Ynez,Mc Grath,ymcgrathm0@soundcloud.com,Female,110.10.155.38,Transport Salt Lake City Utah United States
794,Hervey,Clemensen,hclemensenm1@nba.com,Male,1.245.229.186,Stone Corner San Diego California United States
795,Babb,Prantl,bprantlm2@about.com,Female,224.233.111.35,Barnett Los Angeles California United States
796,Chase,MacAdam,cmacadamm3@wordpress.org,Male,28.87.105.117,Farmco Jackson Mississippi United States
797,Nikkie,Wedgwood,nwedgwoodm4@nbcnews.com,Female,65.108.54.157,Heath Oklahoma City Oklahoma United States
798,Marie,Walaron,mwalaronm5@hud.gov,Female,237.205.114.230,Northport Shreveport Louisiana United States
799,Melania,Murrill,mmurrillm6@omniture.com,Female,162.172.55.243,Manley Salt Lake City Utah United States
800,Freedman,Fleming,fflemingm7@narod.ru,Male,30.179.247.119,Banding Houston Texas United States
801,Carmita,Slaght,cslaghtm8@so-net.ne.jp,Female,134.91.110.224,Holmberg Baltimore Maryland United States
802,See,MacGhee,smacgheem9@jalbum.net,Male,184.128.73.170,Oak Valley Oklahoma City Oklahoma United States
803,Myrah,Pritty,mprittyma@xing.com,Female,189.68.81.106,Barnett Mesa Arizona United States
804,Meridel,Peedell,mpeedellmb@nih.gov,Female,203.125.253.148,Dottie Utica New York United States
805,Reed,Joubert,rjoubertmc@diigo.com,Male,14.106.224.56,Goodland Pinellas Park Florida United States
806,Sandro,Wardley,swardleymd@seattletimes.com,Male,54.184.204.85,Bartelt Arlington Texas United States
807,Bebe,Blesing,bblesingme@vimeo.com,Female,182.189.178.133,Hoepker Cleveland Ohio United States
808,Emmery,Krahl,ekrahlmf@privacy.gov.au,Male,171.25.45.104,Utah Jamaica New York United States
809,Tucker,Officer,tofficermg@dedecms.com,Male,81.113.163.109,Westport San Francisco California United States
810,Griz,Moloney,gmoloneymh@elegantthemes.com,Male,72.204.42.244,Green Ridge Jacksonville Florida United States
811,Allister,Elie,aeliemi@github.com,Male,223.7.173.81,Mesta Des Moines Iowa United States
812,Peggi,Josuweit,pjosuweitmj@bbc.co.uk,Female,18.106.113.197,Stone Corner Indianapolis Indiana United States
813,Zola,Kinneally,zkinneallymk@tripod.com,Female,236.67.79.109,American Shreveport Louisiana United States
814,Gunner,Bonn,gbonnml@weibo.com,Male,86.27.98.227,Boyd Huntington West Virginia United States
815,Faunie,Baudon,fbaudonmm@g.co,Female,234.106.58.98,Veith Austin Texas United States
816,Tamara,Weatherall,tweatherallmn@va.gov,Female,110.36.173.113,Welch Phoenix Arizona United States
817,Waiter,Borrie,wborriemo@zimbio.com,Male,215.147.89.239,Shasta Scranton Pennsylvania United States
818,Rora,Kinworthy,rkinworthymp@sbwire.com,Female,116.16.212.233,Glendale Detroit Michigan United States
819,Fianna,Dibden,fdibdenmq@europa.eu,Female,172.0.76.7,Menomonie Amarillo Texas United States
820,Jamesy,Delgardillo,jdelgardillomr@cnbc.com,Male,99.102.174.124,Bluestem Washington District of Columbia United States
821,Kincaid,Rudge,krudgems@surveymonkey.com,Male,95.131.232.108,Eggendart Cincinnati Ohio United States
822,Vitia,Brownhall,vbrownhallmt@howstuffworks.com,Female,17.249.250.244,Brown Little Rock Arkansas United States
823,Joela,Bibb,jbibbmu@theglobeandmail.com,Female,116.231.170.98,Toban Albany New York United States
824,Aksel,Leinweber,aleinwebermv@woothemes.com,Male,62.150.221.53,Hovde Chula Vista California United States
825,Leoline,Shelley,lshelleymw@github.com,Female,56.47.91.253,Bartillon New York City New York United States
826,Pippy,Giovannardi,pgiovannardimx@intel.com,Female,88.10.130.74,Independence Fargo North Dakota United States
827,Amata,Rathe,arathemy@tuttocitta.it,Female,71.53.86.87,Jay Albuquerque New Mexico United States
828,Pennie,Antonopoulos,pantonopoulosmz@ocn.ne.jp,Female,55.59.23.104,Sage Minneapolis Minnesota United States
829,Joyan,Gainseford,jgainsefordn0@ox.ac.uk,Female,170.199.64.250,Mendota Saint Louis Missouri United States
830,Meris,Hammett,mhammettn1@npr.org,Female,91.50.195.93,Stephen Lubbock Texas United States
831,Solly,Clow,sclown2@ca.gov,Male,194.56.163.178,Bowman Crawfordsville Indiana United States
832,Whitney,Beevis,wbeevisn3@army.mil,Male,8.139.10.185,Rigney Corpus Christi Texas United States
833,Gussy,Gornal,ggornaln4@blogspot.com,Female,77.213.73.201,Blackbird Minneapolis Minnesota United States
834,Rosaline,Van Daalen,rvandaalenn5@smh.com.au,Female,127.208.106.201,Surrey Des Moines Iowa United States
835,Leonora,Ciciotti,lciciottin6@cyberchimps.com,Female,7.195.222.26,Melrose San Francisco California United States
836,Callida,Freddi,cfreddin7@usatoday.com,Female,245.153.99.80,Veith South Bend Indiana United States
837,Winnie,Dossit,wdossitn8@nyu.edu,Male,155.17.152.173,Aberg Phoenix Arizona United States
838,Bil,Purcell,bpurcelln9@tinypic.com,Male,103.134.57.243,Cardinal New York City New York United States
839,Lutero,Bonelle,lbonellena@slashdot.org,Male,29.182.141.51,Debs Hattiesburg Mississippi United States
840,Gard,Knappett,gknappettnb@springer.com,Male,107.187.177.210,Sycamore Charleston West Virginia United States
841,Regen,Redmond,rredmondnc@lulu.com,Male,71.197.33.13,Fairview Lake Charles Louisiana United States
842,Shelley,Butland,sbutlandnd@google.cn,Male,123.28.65.59,Caliangt New Orleans Louisiana United States
843,Brunhilde,Haggish,bhaggishne@netlog.com,Female,221.46.74.46,Green Roanoke Virginia United States
844,Gib,Maysor,gmaysornf@reddit.com,Male,85.81.198.239,Lyons Naples Florida United States
845,Louisette,Sanger,lsangerng@fotki.com,Female,8.190.154.57,Victoria Milwaukee Wisconsin United States
846,Janetta,Boc,jbocnh@businesswire.com,Female,116.217.103.253,Mccormick Memphis Tennessee United States
847,Randolf,Kerswell,rkerswellni@oakley.com,Male,73.180.184.37,Bartelt New Haven Connecticut United States
848,Roxine,Goodwell,rgoodwellnj@earthlink.net,Female,95.198.14.190,Fairfield Lancaster California United States
849,Guglielma,Antonutti,gantonuttink@blogger.com,Female,180.247.130.249,Mosinee Fresno California United States
850,Drusie,Kiehnlt,dkiehnltnl@state.gov,Female,223.202.248.142,Hudson Houston Texas United States
851,Arnoldo,Huetson,ahuetsonnm@delicious.com,Male,141.87.71.94,Mosinee Inglewood California United States
852,Celestia,Casaletto,ccasalettonn@biglobe.ne.jp,Female,234.168.224.161,Eastwood Cincinnati Ohio United States
853,Nanni,Oakeby,noakebyno@wordpress.org,Female,124.136.31.35,Vernon Portland Oregon United States
854,Aldous,Hinksen,ahinksennp@npr.org,Male,165.85.224.159,Hauk Athens Georgia United States
855,Steward,Harragin,sharraginnq@hao123.com,Male,173.78.242.147,Autumn Leaf Lakeland Florida United States
856,Keene,Belbin,kbelbinnr@com.com,Male,160.206.206.110,Farwell Phoenix Arizona United States
857,Thane,Fritzer,tfritzerns@so-net.ne.jp,Male,87.7.220.246,Sauthoff Roanoke Virginia United States
858,Amalee,Lettice,aletticent@cam.ac.uk,Female,109.173.28.58,Russell Riverside California United States
859,Isabella,Caskie,icaskienu@pcworld.com,Female,61.239.193.113,Washington Lexington Kentucky United States
860,Meade,Boyett,mboyettnv@desdev.cn,Male,118.144.59.56,Drewry Spokane Washington United States
861,Smitty,Pattesall,spattesallnw@wikispaces.com,Male,209.186.76.227,Linden Anaheim California United States
862,Babbette,Arkwright,barkwrightnx@google.it,Female,67.170.152.125,Monterey Oklahoma City Oklahoma United States
863,Marjorie,Hounsome,mhounsomeny@dion.ne.jp,Female,11.173.140.60,Nelson Cincinnati Ohio United States
864,Wallas,Schistl,wschistlnz@wired.com,Male,109.175.243.177,Nancy Louisville Kentucky United States
865,Adair,Tagg,ataggo0@dot.gov,Male,86.207.164.85,Leroy Las Vegas Nevada United States
866,Katuscha,Berrecloth,kberreclotho1@fema.gov,Female,149.19.22.69,Bartillon Schenectady New York United States
867,Raymond,Downing,rdowningo2@wikia.com,Male,47.204.228.3,Dennis Inglewood California United States
868,Vasily,Elacoate,velacoateo3@moonfruit.com,Male,137.167.43.213,Maple Chicago Illinois United States
869,Roland,Fiddyment,rfiddymento4@cisco.com,Male,239.188.182.171,Burning Wood Killeen Texas United States
870,Rosemarie,Marron,rmarrono5@acquirethisname.com,Female,85.219.68.52,Quincy Wichita Falls Texas United States
871,Evan,Arnall,earnallo6@gmpg.org,Male,99.72.147.86,Havey Memphis Tennessee United States
872,Sheelagh,Benion,sbeniono7@google.ru,Female,133.164.197.138,Union Los Angeles California United States
873,Jazmin,Pedracci,jpedraccio8@china.com.cn,Female,222.126.180.14,Redwing Athens Georgia United States
874,Shurlock,Jerrard,sjerrardo9@ameblo.jp,Male,92.172.32.56,Memorial Honolulu Hawaii United States
875,Yalonda,Ellice,yelliceoa@liveinternet.ru,Female,186.194.189.122,Pepper Wood Omaha Nebraska United States
876,Augustine,Orpin,aorpinob@themeforest.net,Male,7.13.241.247,Debs Gilbert Arizona United States
877,Anneliese,Sill,asilloc@prnewswire.com,Female,93.60.11.26,Green Ridge Nashville Tennessee United States
878,Karney,Tampen,ktampenod@xrea.com,Male,186.144.144.40,David Abilene Texas United States
879,Arly,Lynam,alynamoe@histats.com,Female,235.34.74.46,Talisman Washington District of Columbia United States
880,Hugo,Sparshott,hsparshottof@odnoklassniki.ru,Male,62.144.172.99,5th Atlanta Georgia United States
881,Ferdy,Cheale,fchealeog@mozilla.org,Male,69.111.16.152,Ridgeway Austin Texas United States
882,Dedie,Snoad,dsnoadoh@freewebs.com,Female,101.41.186.156,Lukken Omaha Nebraska United States
883,Ritchie,Robelin,rrobelinoi@hugedomains.com,Male,237.148.157.135,Moose Baton Rouge Louisiana United States
884,Joshuah,Bea,jbeaoj@hostgator.com,Male,202.180.101.231,Melody Detroit Michigan United States
885,Athena,Jannings,ajanningsok@arstechnica.com,Female,24.195.36.44,Prairieview Los Angeles California United States
886,Evie,Style,estyleol@issuu.com,Female,161.129.14.157,Beilfuss Laurel Maryland United States
887,Aharon,Azemar,aazemarom@sina.com.cn,Male,50.250.234.60,Messerschmidt White Plains New York United States
888,Eva,Bake,ebakeon@plala.or.jp,Female,210.94.155.79,Ridgeway San Diego California United States
889,Cthrine,Priel,cprieloo@latimes.com,Female,135.113.230.52,Towne Hartford Connecticut United States
890,Cacilia,Tabor,ctaborop@rakuten.co.jp,Female,36.13.57.73,Randy Washington District of Columbia United States
891,Artemus,Pencot,apencotoq@angelfire.com,Male,185.212.201.34,Independence Dallas Texas United States
892,Clari,Pietzner,cpietzneror@hugedomains.com,Female,30.26.161.57,Esch Toledo Ohio United States
893,Petr,Lashford,plashfordos@ehow.com,Male,119.214.94.217,Dwight Boca Raton Florida United States
894,Trever,Hebblewaite,thebblewaiteot@google.ru,Male,72.12.114.37,Acker Fort Worth Texas United States
895,Basilius,Maybey,bmaybeyou@rediff.com,Male,11.119.130.205,Elgar North Las Vegas Nevada United States
896,Petronilla,Savege,psavegeov@lycos.com,Female,207.234.138.220,Arrowood Tulsa Oklahoma United States
897,Ive,Jarrard,ijarrardow@hugedomains.com,Male,26.223.96.255,Knutson Melbourne Florida United States
898,Ulla,Deveraux,udeverauxox@virginia.edu,Female,143.112.169.159,Merrick Duluth Minnesota United States
899,Dareen,Olford,dolfordoy@rakuten.co.jp,Female,171.75.204.127,Onsgard Washington District of Columbia United States
900,Giustina,Chasen,gchasenoz@walmart.com,Female,140.43.186.201,Dovetail Newark New Jersey United States
901,Stefano,Rustan,srustanp0@smh.com.au,Male,147.255.172.28,Harbort Columbia Missouri United States
902,Kylen,Dybell,kdybellp1@hibu.com,Female,185.92.80.120,Sutherland Columbia South Carolina United States
903,L;urette,McMorland,lmcmorlandp2@chron.com,Female,128.219.120.22,Oxford Glendale Arizona United States
904,Bertram,Toland,btolandp3@about.com,Male,144.216.141.104,Stephen Milwaukee Wisconsin United States
905,Melesa,Copping,mcoppingp4@nifty.com,Female,66.82.147.104,Mockingbird Yonkers New York United States
906,Rogerio,Torres,rtorresp5@people.com.cn,Male,66.221.0.240,Ronald Regan Louisville Kentucky United States
907,Remy,Darville,rdarvillep6@barnesandnoble.com,Female,184.150.165.131,Dexter Brockton Massachusetts United States
908,Irwin,Bacchus,ibacchusp7@marketwatch.com,Male,215.41.70.199,Golf View Corona California United States
909,Benedikta,Raddish,braddishp8@taobao.com,Female,253.198.202.64,Becker Jamaica New York United States
910,Ardyth,Dossit,adossitp9@desdev.cn,Female,155.203.252.70,Longview Gainesville Florida United States
911,Bartlett,Glasspoole,bglasspoolepa@indiatimes.com,Male,140.82.103.182,Buena Vista West Palm Beach Florida United States
912,Stella,Idney,sidneypb@google.pl,Female,56.243.192.30,Northview Cedar Rapids Iowa United States
913,Gerri,Hibbart,ghibbartpc@businesswire.com,Female,216.172.132.14,Bluestem Tulsa Oklahoma United States
914,Janeczka,Giovannacci,jgiovannaccipd@dyndns.org,Female,4.149.252.247,Waywood Decatur Illinois United States
915,Jan,Wickrath,jwickrathpe@webeden.co.uk,Female,51.150.69.26,Schurz Peoria Illinois United States
916,Ki,Prestedge,kprestedgepf@cbsnews.com,Female,239.89.37.129,Moulton Minneapolis Minnesota United States
917,Dickie,Corry,dcorrypg@bing.com,Male,66.158.85.62,Amoth Seattle Washington United States
918,Marcel,Heersema,mheersemaph@eepurl.com,Male,195.151.184.99,Graedel Las Vegas Nevada United States
919,Cortney,Cases,ccasespi@ycombinator.com,Female,135.26.250.159,Lotheville Silver Spring Maryland United States
920,Dave,MacNeice,dmacneicepj@wikispaces.com,Male,123.99.110.71,Red Cloud Phoenix Arizona United States
921,Alejoa,Werendell,awerendellpk@gizmodo.com,Male,255.72.205.152,Morrow Young America Minnesota United States
922,Von,Janks,vjankspl@cdbaby.com,Male,176.161.11.213,Bluejay Tacoma Washington United States
923,Andrej,Warrick,awarrickpm@noaa.gov,Male,236.232.186.10,Towne Elmira New York United States
924,Noni,Weldon,nweldonpn@stanford.edu,Female,122.221.203.106,Marcy Wilkes Barre Pennsylvania United States
925,Maegan,Gullick,mgullickpo@latimes.com,Female,40.211.229.83,Dunning Sacramento California United States
926,Guinevere,Blitz,gblitzpp@issuu.com,Female,135.153.231.248,Heffernan Roanoke Virginia United States
927,Tibold,Moulton,tmoultonpq@indiegogo.com,Male,12.182.40.185,Upham Memphis Tennessee United States
928,Brice,Osbidston,bosbidstonpr@wp.com,Male,240.213.6.205,Glendale Saint Petersburg Florida United States
929,Haven,Domotor,hdomotorps@jiathis.com,Male,89.63.12.249,Drewry Annapolis Maryland United States
930,Zachary,Reditt,zredittpt@businessweek.com,Male,254.184.185.48,Pearson Torrance California United States
931,Kissie,Spykins,kspykinspu@bizjournals.com,Female,96.14.35.76,Melody College Station Texas United States
932,Elias,Gouldsmith,egouldsmithpv@sitemeter.com,Male,173.128.229.224,Del Mar Montpelier Vermont United States
933,Alyse,Bedborough,abedboroughpw@bbb.org,Female,179.204.245.180,Moulton Winston Salem North Carolina United States
934,Pauli,Crone,pcronepx@cbslocal.com,Female,250.117.50.30,Pankratz Atlanta Georgia United States
935,Kerwinn,Lockney,klockneypy@fc2.com,Male,27.165.160.35,Everett Miami Florida United States
936,Ynes,Englishby,yenglishbypz@amazon.com,Female,19.176.87.116,Bellgrove Chicago Illinois United States
937,Hiram,Sainte Paul,hsaintepaulq0@mayoclinic.com,Male,1.129.197.196,Emmet Orlando Florida United States
938,Ange,Gooding,agoodingq1@google.ru,Male,28.241.138.155,Quincy Orlando Florida United States
939,Christan,Salzberger,csalzbergerq2@spiegel.de,Female,128.204.16.70,Manley Austin Texas United States
940,Mechelle,Phillips,mphillipsq3@google.it,Female,73.223.76.26,Stone Corner Greenville South Carolina United States
941,Kit,Gandey,kgandeyq4@arstechnica.com,Male,148.224.254.158,Lukken Naperville Illinois United States
942,Annmarie,Stoffler,astofflerq5@artisteer.com,Female,186.178.132.239,Bartillon Philadelphia Pennsylvania United States
943,Brenda,Lythgoe,blythgoeq6@army.mil,Female,39.147.243.212,Grayhawk Milwaukee Wisconsin United States
944,Dominica,Simonsson,dsimonssonq7@harvard.edu,Female,56.147.212.18,Schiller New York City New York United States
945,Tamara,Cakebread,tcakebreadq8@nsw.gov.au,Female,136.105.60.242,Loeprich Fort Wayne Indiana United States
946,Lovell,Domanski,ldomanskiq9@last.fm,Male,166.57.130.223,Spohn Detroit Michigan United States
947,Sharona,Keene,skeeneqa@virginia.edu,Female,236.104.76.111,Ramsey Stamford Connecticut United States
948,Mick,Gasparro,mgasparroqb@liveinternet.ru,Male,135.56.207.189,Monica El Paso Texas United States
949,Kaye,Corner,kcornerqc@technorati.com,Female,29.26.126.201,Erie Davenport Iowa United States
950,Con,Wasbrough,cwasbroughqd@wufoo.com,Female,160.144.87.91,7th Montgomery Alabama United States
951,Jose,Oddie,joddieqe@time.com,Male,46.242.13.142,Everett Salt Lake City Utah United States
952,Staci,Haydock,shaydockqf@eventbrite.com,Female,111.141.180.134,Huxley Miami Beach Florida United States
953,Dorelia,Guidi,dguidiqg@parallels.com,Female,164.251.66.36,Forest Run Lubbock Texas United States
954,Devan,Marchbank,dmarchbankqh@blogtalkradio.com,Female,32.37.66.87,Waubesa Tampa Florida United States
955,Allistir,Mackleden,amackledenqi@hibu.com,Male,21.84.181.191,Kennedy Kalamazoo Michigan United States
956,Whitney,Dalgetty,wdalgettyqj@over-blog.com,Male,142.97.80.42,Browning Naples Florida United States
957,Cullin,Yarrington,cyarringtonqk@surveymonkey.com,Male,87.147.9.184,Hoffman Pompano Beach Florida United States
958,Bax,Santi,bsantiql@disqus.com,Male,226.77.110.161,Fieldstone Daytona Beach Florida United States
959,Rusty,Tureville,rturevilleqm@un.org,Male,173.251.240.123,Gulseth Ocala Florida United States
960,Peyter,Billin,pbillinqn@multiply.com,Male,49.249.251.95,Truax El Paso Texas United States
961,Carlina,Whysall,cwhysallqo@yelp.com,Female,119.184.34.185,Oriole Bonita Springs Florida United States
962,Payton,Clopton,pcloptonqp@epa.gov,Male,67.165.13.247,Cambridge Rochester New York United States
963,Nedi,Huntly,nhuntlyqq@blogspot.com,Female,233.224.187.143,Lindbergh Sacramento California United States
964,Noelani,Lees,nleesqr@ocn.ne.jp,Female,222.0.29.30,Marquette Cleveland Ohio United States
965,Darn,Woolerton,dwoolertonqs@hibu.com,Male,202.195.99.182,Sutherland Lexington Kentucky United States
966,Pavia,Bullan,pbullanqt@google.fr,Female,35.85.158.166,Warrior San Diego California United States
967,Eugenius,Corday,ecordayqu@tinyurl.com,Male,250.111.244.242,Huxley Baltimore Maryland United States
968,Keary,Landes,klandesqv@state.tx.us,Male,194.237.47.22,Vernon North Hollywood California United States
969,Skippy,Hagergham,shagerghamqw@reverbnation.com,Male,127.242.230.30,Shopko Dayton Ohio United States
970,Deloria,Grocock,dgrocockqx@fema.gov,Female,120.230.239.179,Sutherland Bismarck North Dakota United States
971,Ogdon,Plunkett,oplunkettqy@uiuc.edu,Male,184.26.92.134,Glacier Hill Sacramento California United States
972,Galvin,Ten Broek,gtenbroekqz@amazonaws.com,Male,117.212.161.26,Sunfield Detroit Michigan United States
973,Fran,Billam,fbillamr0@adobe.com,Male,221.164.164.182,Warbler Brooklyn New York United States
974,Kristien,Cassedy,kcassedyr1@printfriendly.com,Female,170.172.129.156,Oak Valley Migrate Kentucky United States
975,Brody,Squibb,bsquibbr2@4shared.com,Male,65.21.253.250,Glendale Atlanta Georgia United States
976,Falito,Grossman,fgrossmanr3@hud.gov,Male,79.140.3.130,Lake View Little Rock Arkansas United States
977,Alric,Ralling,arallingr4@topsy.com,Male,96.26.196.197,Buell Killeen Texas United States
978,Yurik,Smaridge,ysmaridger5@washingtonpost.com,Male,233.4.155.171,Bultman Chicago Illinois United States
979,Clerissa,Hamshar,chamsharr6@1und1.de,Female,202.241.120.201,Weeping Birch Saint Louis Missouri United States
980,Raquel,Lilleyman,rlilleymanr7@google.es,Female,216.145.31.120,Hudson Washington District of Columbia United States
981,Kasey,Paschek,kpaschekr8@epa.gov,Female,122.51.168.177,Declaration Indianapolis Indiana United States
982,Ketti,Fewkes,kfewkesr9@who.int,Female,249.38.53.190,Roxbury Reno Nevada United States
983,Tamara,Gameson,tgamesonra@loc.gov,Female,41.197.6.187,3rd Chattanooga Tennessee United States
984,Lexy,Dunkerton,ldunkertonrb@howstuffworks.com,Female,150.118.249.97,Colorado New York City New York United States
985,Daniella,Sermin,dserminrc@unicef.org,Female,67.216.200.80,Beilfuss Memphis Tennessee United States
986,Karlie,Coiley,kcoileyrd@wsj.com,Female,223.50.247.221,Cody Utica New York United States
987,Bryn,Leithgoe,bleithgoere@tiny.cc,Male,162.225.32.179,Burning Wood El Paso Texas United States
988,Packston,Althorp,palthorprf@gizmodo.com,Male,128.19.67.87,Arkansas Louisville Kentucky United States
989,Harold,Alred,halredrg@gizmodo.com,Male,236.31.7.141,Amoth Santa Ana California United States
990,Allyn,McCrystal,amccrystalrh@addthis.com,Female,95.165.203.48,Bashford Las Vegas Nevada United States
991,Iosep,Robison,irobisonri@columbia.edu,Male,173.117.108.178,American Kansas City Missouri United States
992,Carce,Costerd,ccosterdrj@rambler.ru,Male,103.252.112.75,Manufacturers Baltimore Maryland United States
993,Garold,Pridding,gpriddingrk@vk.com,Male,179.217.102.253,Bay Pompano Beach Florida United States
994,Aluin,Sinnie,asinnierl@apple.com,Male,13.243.241.72,Thierer New Orleans Louisiana United States
995,Ursa,Fabb,ufabbrm@wiley.com,Female,136.14.144.221,Oriole Scranton Pennsylvania United States
