id,first_name,last_name,email,gender,ip_address,address
2232,Becca,Downer,bdowner6f@state.gov,Female,0.217.182.198,Pond Charleston South Carolina United States
2233,Heywood,Sealeaf,hsealeaf6g@php.net,Male,164.79.111.187,Merry New York City New York United States
2234,Bride,Kubasiewicz,bkubasiewicz6h@51.la,Female,150.99.121.16,Raven Fort Worth Texas United States
2235,Mehetabel,Lorinez,mlorinez6i@vinaora.com,Female,28.115.184.229,Pepper Wood Atlanta Georgia United States
2236,Scot,Meaking,smeaking6j@t-online.de,Male,1.210.137.84,Parkside Des Moines Iowa United States
2237,Godart,Yvens,gyvens6k@cargocollective.com,Male,131.186.37.130,Bartelt Santa Barbara California United States
2238,Moss,Carder,mcarder6l@nature.com,Male,135.76.93.218,Dorton North Hollywood California United States
2239,Obediah,Lethlay,olethlay6m@nih.gov,Male,220.135.31.223,Magdeline Decatur Georgia United States
2240,Ross,Roussell,rroussell6n@huffingtonpost.com,Male,124.105.227.67,Washington Huntsville Alabama United States
2241,Amby,McOmish,amcomish6o@blogs.com,Male,124.163.118.149,2nd Tulsa Oklahoma United States
2242,Reuben,Swaffield,rswaffield6p@gov.uk,Male,54.149.74.147,Anhalt Pasadena California United States
2243,Tirrell,Farn,tfarn6q@china.com.cn,Male,216.60.82.34,Melvin Philadelphia Pennsylvania United States
2244,Clive,Hember,chember6r@comsenz.com,Male,181.61.80.48,Maywood Phoenix Arizona United States
2245,Curry,Littrik,clittrik6s@uiuc.edu,Male,162.100.78.5,Longview Miami Florida United States
2246,Matelda,Leverette,mleverette6t@time.com,Female,85.49.202.67,Lawn Olympia Washington United States
2247,Leodora,Burrass,lburrass6u@behance.net,Female,124.173.218.168,Elka Fairfield Connecticut United States
2248,Ody,Coneau,oconeau6v@simplemachines.org,Male,17.127.140.171,Melrose Warren Ohio United States
2249,Binni,Dowyer,bdowyer6w@techcrunch.com,Female,127.112.248.153,Park Meadow Young America Minnesota United States
2250,Emlyn,Divill,edivill6x@pcworld.com,Male,0.35.132.195,Little Fleur Springfield Massachusetts United States
2251,Terri,Tevelov,ttevelov6y@uol.com.br,Male,26.237.36.31,Pepper Wood Topeka Kansas United States
2252,Britt,Frisel,bfrisel6z@dot.gov,Female,56.56.98.223,David Anaheim California United States
2253,Joelly,Radsdale,jradsdale70@parallels.com,Female,209.140.132.222,Reindahl Los Angeles California United States
2254,Amie,Caughan,acaughan71@prweb.com,Female,38.13.165.2,Texas Las Vegas Nevada United States
2255,Ugo,Hubane,uhubane72@blogger.com,Male,197.63.202.118,Lindbergh Laredo Texas United States
2256,Robbert,Westcar,rwestcar73@studiopress.com,Male,25.150.76.220,Glendale Monticello Minnesota United States
2257,Adora,Deeney,adeeney74@hhs.gov,Female,7.22.184.62,Johnson Murfreesboro Tennessee United States
2258,Christian,Tranfield,ctranfield75@rakuten.co.jp,Female,155.76.89.233,Delaware Lawrenceville Georgia United States
2259,Taddeusz,O'Kieran,tokieran76@admin.ch,Male,11.123.12.4,Di Loreto Lansing Michigan United States
2260,Ellis,Hedworth,ehedworth77@discuz.net,Male,100.48.130.237,Rowland Columbia Missouri United States
2261,Mal,Cobain,mcobain78@spiegel.de,Male,55.240.213.155,Mayfield Washington District of Columbia United States
2262,Trevar,McCloid,tmccloid79@hud.gov,Male,196.45.128.48,American Ash Washington District of Columbia United States
2263,Jeannie,Gorioli,jgorioli7a@ovh.net,Female,116.155.135.178,Onsgard Spokane Washington United States
2264,Brew,Jacquemy,bjacquemy7b@imageshack.us,Male,236.185.248.201,Anthes Fargo North Dakota United States
2265,Clovis,Tomson,ctomson7c@microsoft.com,Female,192.237.182.103,Carpenter Seattle Washington United States
2266,Cy,Utteridge,cutteridge7d@amazon.de,Male,127.126.252.166,Onsgard Lexington Kentucky United States
2267,Birk,McGiffie,bmcgiffie7e@wired.com,Male,57.44.196.199,Debra Cheyenne Wyoming United States
2268,Cathie,Wrotchford,cwrotchford7f@pinterest.com,Female,192.252.103.133,Summerview Des Moines Iowa United States
2269,Trstram,Delete,tdelete7g@bloglovin.com,Male,174.204.81.138,Comanche Round Rock Texas United States
2270,Adolphe,Danielut,adanielut7h@eepurl.com,Male,231.198.249.88,Thackeray Spokane Washington United States
2271,Saundra,Goodhand,sgoodhand7i@prlog.org,Female,229.39.186.180,Wayridge Newark Delaware United States
2272,Elana,Really,ereally7j@cpanel.net,Female,199.43.206.76,Lyons Van Nuys California United States
2273,Lyssa,Dumbarton,ldumbarton7k@163.com,Female,43.116.161.148,Hagan Philadelphia Pennsylvania United States
2274,Reamonn,Prantl,rprantl7l@gravatar.com,Male,144.156.249.250,Coleman Houston Texas United States
2275,Mandie,McCarver,mmccarver7m@ox.ac.uk,Female,59.196.30.102,Nobel Colorado Springs Colorado United States
2276,Lance,Winter,lwinter7n@cornell.edu,Male,203.178.137.94,Crowley Miami Florida United States
2277,Rhett,Nanninini,rnanninini7o@cdc.gov,Male,205.245.74.189,Sutteridge Colorado Springs Colorado United States
2278,Olimpia,Rate,orate7p@angelfire.com,Female,38.161.225.186,Lillian Portsmouth Virginia United States
2279,Libby,Blackeby,lblackeby7q@slate.com,Female,195.22.146.122,Fieldstone Baton Rouge Louisiana United States
2280,Esmaria,Servis,eservis7r@oaic.gov.au,Female,130.227.204.135,7th Detroit Michigan United States
2281,Arabele,Treske,atreske7s@artisteer.com,Female,142.224.246.69,Glacier Hill Young America Minnesota United States
2282,Corrianne,Adkin,cadkin7t@eventbrite.com,Female,149.48.91.66,Carioca Colorado Springs Colorado United States
2283,Neill,Gauler,ngauler7u@4shared.com,Male,145.175.115.189,Summer Ridge El Paso Texas United States
2284,Avigdor,Jose,ajose7v@amazonaws.com,Male,51.89.42.178,Haas Denver Colorado United States
2285,Mathe,Robbe,mrobbe7w@house.gov,Male,49.173.25.57,Welch Montgomery Alabama United States
2286,Calypso,Sidon,csidon7x@go.com,Female,120.37.210.230,Springview Schenectady New York United States
2287,Alejandro,Toupe,atoupe7y@skype.com,Male,232.69.51.66,Harbort Richmond Virginia United States
2288,Gav,Unwin,gunwin7z@chicagotribune.com,Male,167.142.82.209,Moose Austin Texas United States
2289,Leann,McCorkindale,lmccorkindale80@privacy.gov.au,Female,32.7.0.79,Sachs Tampa Florida United States
2290,Dorothee,Crighton,dcrighton81@360.cn,Female,154.29.218.73,Oriole Huntington West Virginia United States
2291,Buiron,Lindelof,blindelof82@issuu.com,Male,150.225.51.48,Steensland Buffalo New York United States
2292,Ethe,Walewski,ewalewski83@thetimes.co.uk,Male,80.98.142.1,Lighthouse Bay Tallahassee Florida United States
2293,Stillman,Girdler,sgirdler84@reverbnation.com,Male,4.19.113.16,Eastlawn Los Angeles California United States
2294,Karalynn,Elger,kelger85@huffingtonpost.com,Female,171.215.29.11,Rieder Saint Paul Minnesota United States
2295,Rebbecca,Sparkwill,rsparkwill86@pen.io,Female,169.231.122.168,Londonderry Pasadena California United States
2296,Gustie,Ioannou,gioannou87@domainmarket.com,Female,45.245.197.133,Esker Sacramento California United States
2297,Julissa,Armfield,jarmfield88@xing.com,Female,189.48.190.157,Cherokee Macon Georgia United States
2298,Piotr,Joney,pjoney89@hc360.com,Male,3.87.192.65,Merry Birmingham Alabama United States
2299,Cleopatra,Logsdail,clogsdail8a@hp.com,Female,136.122.199.25,Eliot Birmingham Alabama United States
2300,Rosy,Allmen,rallmen8b@prweb.com,Female,125.6.70.150,8th Charlotte North Carolina United States
2301,Cayla,Rigden,crigden8c@reverbnation.com,Female,57.145.251.6,Tennyson Lansing Michigan United States
2302,Joel,Parysiak,jparysiak8d@github.com,Male,97.145.253.103,American New York City New York United States
2303,Ellyn,Avramov,eavramov8e@senate.gov,Female,47.79.50.106,Onsgard Seattle Washington United States
2304,Noak,Symmers,nsymmers8f@answers.com,Male,227.214.188.4,Aberg New Haven Connecticut United States
2305,Chastity,Nicholl,cnicholl8g@sina.com.cn,Female,124.196.245.250,Onsgard Washington District of Columbia United States
2306,Linell,Justis,ljustis8h@dailymail.co.uk,Female,174.126.107.103,Del Mar Indianapolis Indiana United States
2307,Angela,Proger,aproger8i@google.nl,Female,150.63.76.71,Anniversary Youngstown Ohio United States
2308,Townie,Huitt,thuitt8j@youtu.be,Male,254.156.53.173,Northport Green Bay Wisconsin United States
2309,Gannie,Crosham,gcrosham8k@exblog.jp,Male,165.64.176.181,Buena Vista Lafayette Louisiana United States
2310,Vail,MacGillicuddy,vmacgillicuddy8l@csmonitor.com,Male,177.39.228.121,Muir Fort Worth Texas United States
2311,Berty,Gruszka,bgruszka8m@who.int,Female,23.73.163.32,Longview Cincinnati Ohio United States
2312,Huberto,Tenby,htenby8n@reference.com,Male,100.146.32.84,Aberg Reno Nevada United States
2313,Trenna,Gordge,tgordge8o@answers.com,Female,236.33.187.243,Sunbrook North Hollywood California United States
2314,Brice,Dunkerly,bdunkerly8p@marriott.com,Male,193.236.75.163,Montana New Orleans Louisiana United States
2315,Kerk,Casterton,kcasterton8q@mapquest.com,Male,22.253.253.36,Towne Los Angeles California United States
2316,Rem,MacCafferty,rmaccafferty8r@liveinternet.ru,Male,16.197.115.147,Pankratz Maple Plain Minnesota United States
2317,Antonietta,Coddrington,acoddrington8s@example.com,Female,72.83.65.236,Grayhawk Cincinnati Ohio United States
2318,Tove,Powlesland,tpowlesland8t@is.gd,Female,176.115.228.21,5th Orlando Florida United States
2319,Alissa,Megarry,amegarry8u@list-manage.com,Female,86.219.105.184,High Crossing Sterling Virginia United States
2320,Alfonso,Otter,aotter8v@mapy.cz,Male,140.225.19.246,Graceland Provo Utah United States
2321,Brien,Bickersteth,bbickersteth8w@rambler.ru,Male,96.235.75.41,Transport Albuquerque New Mexico United States
2322,Anabel,Chichgar,achichgar8x@nba.com,Female,68.240.158.21,Dapin Sacramento California United States
2323,Jackie,Tacker,jtacker8y@acquirethisname.com,Male,224.61.242.227,Tennyson Mesa Arizona United States
2324,Oates,Petrou,opetrou8z@comcast.net,Male,210.168.3.12,Merchant San Diego California United States
2325,Teodor,Cockshtt,tcockshtt90@fema.gov,Male,89.176.1.37,Elmside New Hyde Park New York United States
2326,Aldric,Beat,abeat91@cbc.ca,Male,82.88.110.145,Summerview Oklahoma City Oklahoma United States
2327,Arte,Fossord,afossord92@wikispaces.com,Male,116.254.253.142,Cambridge Albany New York United States
2328,Jillane,McCawley,jmccawley93@baidu.com,Female,126.3.112.33,Eastlawn Fort Lauderdale Florida United States
2329,Carlye,Chatel,cchatel94@fastcompany.com,Female,3.145.118.235,Morningstar Corpus Christi Texas United States
2330,Jeanelle,Giovannazzi,jgiovannazzi95@hp.com,Female,248.15.108.17,Oak Valley Cleveland Ohio United States
2331,Morna,Muldownie,mmuldownie96@bigcartel.com,Female,164.242.253.47,Del Mar Tacoma Washington United States
2332,Michelle,McEllen,mmcellen97@scientificamerican.com,Female,229.140.234.87,Columbus Fresno California United States
2333,Woodie,Costen,wcosten98@hatena.ne.jp,Male,210.109.133.31,Acker Kansas City Missouri United States
2334,Biddy,Guynemer,bguynemer99@ted.com,Female,10.234.109.39,Tony San Francisco California United States
2335,Martie,Addinall,maddinall9a@nyu.edu,Female,215.129.19.245,Namekagon Burbank California United States
2336,Winston,Matashkin,wmatashkin9b@github.com,Male,210.176.92.241,Havey Springfield Massachusetts United States
2337,Haywood,Tabord,htabord9c@yahoo.com,Male,175.226.82.11,Iowa Tampa Florida United States
2338,Melva,Rayman,mrayman9d@google.ru,Female,46.89.232.221,Esch Shreveport Louisiana United States
2339,Addison,Loughran,aloughran9e@yandex.ru,Male,60.131.214.2,Columbus Omaha Nebraska United States
2340,Tadio,Esel,tesel9f@gmpg.org,Male,113.236.51.125,Farmco Los Angeles California United States
2341,Herman,Braghini,hbraghini9g@dedecms.com,Male,231.123.85.239,Alpine Philadelphia Pennsylvania United States
2342,Drusy,Hardeman,dhardeman9h@printfriendly.com,Female,36.188.181.18,Cambridge Omaha Nebraska United States
2343,Barron,Trollope,btrollope9i@free.fr,Male,174.187.89.220,Welch Houston Texas United States
2344,Graeme,Cogin,gcogin9j@topsy.com,Male,197.228.106.241,Orin Gilbert Arizona United States
2345,Josh,Fanti,jfanti9k@cdbaby.com,Male,110.212.221.152,Utah Fargo North Dakota United States
2346,Pierrette,Brunnstein,pbrunnstein9l@simplemachines.org,Female,218.183.191.20,Mosinee Pueblo Colorado United States
2347,Stearne,Radband,sradband9m@drupal.org,Male,27.202.215.47,Clarendon Phoenix Arizona United States
2348,Perrine,Waggett,pwaggett9n@usatoday.com,Female,82.31.235.255,Thierer Albany New York United States
2349,Trina,Union,tunion9o@wordpress.org,Female,238.84.219.33,Eastwood Kansas City Missouri United States
2350,Cornie,Goward,cgoward9p@twitpic.com,Male,117.212.33.89,Bellgrove Lexington Kentucky United States
2351,Hamid,Ronaldson,hronaldson9q@unc.edu,Male,101.99.125.189,Bultman Cincinnati Ohio United States
2352,Nanine,Dillway,ndillway9r@godaddy.com,Female,128.3.189.73,Haas Oklahoma City Oklahoma United States
2353,Chrystel,Peron,cperon9s@unicef.org,Female,254.34.5.201,Monument Washington District of Columbia United States
2354,Sanderson,Buncombe,sbuncombe9t@cnbc.com,Male,52.136.83.85,Summit Brooklyn New York United States
2355,Simonne,Alyonov,salyonov9u@storify.com,Female,114.87.2.164,Lakewood Gardens Lubbock Texas United States
2356,Mala,Goater,mgoater9v@google.co.uk,Female,76.55.159.90,Mallory Detroit Michigan United States
2357,Cary,Suermeier,csuermeier9w@sohu.com,Male,240.11.69.229,Superior San Antonio Texas United States
2358,Gardie,Canelas,gcanelas9x@woothemes.com,Male,142.36.116.90,Golf Charlotte North Carolina United States
2359,Elinor,Ezele,eezele9y@bbc.co.uk,Female,218.49.217.26,Buena Vista Meridian Mississippi United States
2360,Lenee,Stores,lstores9z@omniture.com,Female,222.0.165.159,Trailsway Sunnyvale California United States
2361,Ingaborg,Davall,idavalla0@squarespace.com,Female,59.230.141.58,Mcbride Provo Utah United States
2362,Victoria,Strowther,vstrowthera1@prweb.com,Female,38.46.28.191,Green Ridge Naples Florida United States
2363,Henderson,Porkiss,hporkissa2@macromedia.com,Male,11.138.90.209,Prentice Long Beach California United States
2364,Abbie,Beceril,abecerila3@dropbox.com,Female,181.153.101.101,Mitchell Oklahoma City Oklahoma United States
2365,Anstice,Cox,acoxa4@utexas.edu,Female,157.216.212.252,Bay Saginaw Michigan United States
2366,Myrtie,Summerill,msummerilla5@ask.com,Female,250.113.169.110,Mallory Washington District of Columbia United States
2367,Rozella,O'Neal,roneala6@apple.com,Female,203.233.188.187,Fuller Charlotte North Carolina United States
2368,Inez,Momford,imomforda7@mashable.com,Female,21.69.226.103,Rutledge Kansas City Kansas United States
2369,Karyl,Gowdridge,kgowdridgea8@google.com,Female,223.91.249.222,Charing Cross Syracuse New York United States
2370,Mateo,Salomon,msalomona9@mediafire.com,Male,5.81.28.94,Straubel Richmond Virginia United States
2371,Hardy,Knowlys,hknowlysaa@nasa.gov,Male,31.95.11.239,Kennedy Baltimore Maryland United States
2372,Rikki,Ginner,rginnerab@wikispaces.com,Male,144.141.158.139,Susan Roanoke Virginia United States
2373,Ali,Wyper,awyperac@unc.edu,Female,15.173.177.178,Morning Dallas Texas United States
2374,Idette,Slessar,islessarad@hatena.ne.jp,Female,173.139.104.141,Bultman Mesquite Texas United States
2375,Chantalle,Ochterlonie,cochterlonieae@ask.com,Female,193.224.110.49,Sundown Pueblo Colorado United States
2376,Earvin,Hurlin,ehurlinaf@blogs.com,Male,158.93.135.179,Southridge Charlotte North Carolina United States
2377,Adan,Blanchard,ablanchardag@cmu.edu,Male,102.237.193.27,Roth Trenton New Jersey United States
2378,Luke,Jefferd,ljefferdah@merriam-webster.com,Male,185.248.62.106,Talmadge Des Moines Iowa United States
2379,Hebert,Joontjes,hjoontjesai@apache.org,Male,250.251.63.113,Linden Corpus Christi Texas United States
2380,Milt,Stockbridge,mstockbridgeaj@cbc.ca,Male,244.185.255.19,3rd San Francisco California United States
2381,Egan,Postles,epostlesak@odnoklassniki.ru,Male,44.2.248.150,North Grand Rapids Michigan United States
2382,Corbett,Gumby,cgumbyal@umich.edu,Male,174.14.80.183,Walton New York City New York United States
2383,Hube,Van T'Hoog,hvanthoogam@google.com.au,Male,124.184.11.49,Larry Humble Texas United States
2384,Nowell,Karlqvist,nkarlqvistan@cargocollective.com,Male,106.175.98.240,Esker Valdosta Georgia United States
2385,Elka,Juniper,ejuniperao@t-online.de,Female,255.78.197.56,Basil Erie Pennsylvania United States
2386,Babara,Gittose,bgittoseap@exblog.jp,Female,93.90.91.253,Sunbrook Corpus Christi Texas United States
2387,Rowland,Townsley,rtownsleyaq@bizjournals.com,Male,131.165.133.222,Tennyson Syracuse New York United States
2388,Codi,Sapsforde,csapsfordear@chronoengine.com,Male,182.225.92.205,Blaine Yonkers New York United States
2389,Thorsten,Lowles,tlowlesas@amazon.co.jp,Male,85.186.56.223,Green El Paso Texas United States
2390,Mae,Chanders,mchandersat@acquirethisname.com,Female,5.30.7.113,Burning Wood Jamaica New York United States
2391,Martelle,Macquire,mmacquireau@mtv.com,Female,211.84.115.168,Erie Toledo Ohio United States
2392,Guinevere,Eadington,geadingtonav@exblog.jp,Female,14.107.113.133,Continental Seattle Washington United States
2393,Felix,Franceschelli,ffranceschelliaw@comcast.net,Male,57.158.79.243,Morningstar Lubbock Texas United States
2394,Rich,Joslin,rjoslinax@printfriendly.com,Male,247.197.243.203,Forest Erie Pennsylvania United States
2395,Madlen,Crose,mcroseay@nba.com,Female,210.121.79.182,Mccormick Lees Summit Missouri United States
2396,Cate,Josse,cjosseaz@creativecommons.org,Female,168.37.92.168,Declaration San Francisco California United States
2397,Carley,Horder,chorderb0@slideshare.net,Female,62.78.204.117,Westend Spartanburg South Carolina United States
2398,Terencio,Solloway,tsollowayb1@slashdot.org,Male,95.208.242.10,Crowley Boca Raton Florida United States
2399,Ossie,Van den Dael,ovandendaelb2@adobe.com,Male,220.27.236.212,Monica Kansas City Kansas United States
2400,Ramona,Reavell,rreavellb3@prlog.org,Female,224.236.79.63,Butternut Peoria Illinois United States
2401,Pippo,Brattan,pbrattanb4@google.ca,Male,224.42.45.245,Morrow Sacramento California United States
2402,Jada,Tropman,jtropmanb5@ow.ly,Female,178.107.207.4,Mayfield Tallahassee Florida United States
2403,Sibella,Pickover,spickoverb6@parallels.com,Female,227.89.86.66,Forest Brooklyn New York United States
2404,Kenneth,Flacknell,kflacknellb7@weibo.com,Male,119.3.188.172,Golf Course Akron Ohio United States
2405,Evita,Rathbourne,erathbourneb8@jimdo.com,Female,245.245.102.187,Gerald Chicago Illinois United States
2406,Moyna,Roch,mrochb9@sina.com.cn,Female,139.174.202.244,Southridge Tucson Arizona United States
2407,Erek,Swiers,eswiersba@mail.ru,Male,240.166.237.31,Wayridge Meridian Mississippi United States
2408,Emerson,Southwick,esouthwickbb@ehow.com,Male,40.166.241.128,Sommers Tampa Florida United States
2409,Stephani,Wenger,swengerbc@uiuc.edu,Female,69.0.236.148,Claremont Young America Minnesota United States
2410,Caitlin,Cisar,ccisarbd@psu.edu,Female,255.69.214.31,Bartillon Minneapolis Minnesota United States
2411,Merridie,Luckcuck,mluckcuckbe@jigsy.com,Female,100.230.149.241,Northview Albuquerque New Mexico United States
2412,Mala,Dury,mdurybf@sfgate.com,Female,201.231.54.213,Stoughton Baltimore Maryland United States
2413,Valerie,Gummer,vgummerbg@cloudflare.com,Female,217.124.99.6,Warbler Trenton New Jersey United States
2414,Issy,Trimble,itrimblebh@msu.edu,Female,229.215.145.2,Nelson Beaufort South Carolina United States
2415,Zorine,Lomas,zlomasbi@illinois.edu,Female,133.78.209.45,Crowley Los Angeles California United States
2416,Edgardo,Scoular,escoularbj@live.com,Male,53.164.188.38,Rieder Jackson Mississippi United States
2417,Garreth,Allaker,gallakerbk@seattletimes.com,Male,75.174.100.8,Dayton New Orleans Louisiana United States
2418,Wylma,Dowtry,wdowtrybl@typepad.com,Female,246.190.111.10,Golf View Kansas City Missouri United States
2419,Carolan,Seely,cseelybm@huffingtonpost.com,Female,27.105.165.118,Maywood Littleton Colorado United States
2420,Nerissa,Murthwaite,nmurthwaitebn@reddit.com,Female,209.196.252.2,Hazelcrest Miami Florida United States
2421,Oby,McCarry,omccarrybo@netlog.com,Male,61.237.109.148,Talisman Elizabeth New Jersey United States
2422,Ricki,Gumery,rgumerybp@example.com,Female,194.171.161.17,Lien Tacoma Washington United States
2423,Heath,Barnfield,hbarnfieldbq@tamu.edu,Male,153.88.236.87,Duke Washington District of Columbia United States
2424,Frederic,Feares,ffearesbr@moonfruit.com,Male,88.108.18.107,Amoth Salt Lake City Utah United States
2425,Wald,Sommer,wsommerbs@washington.edu,Male,70.142.185.200,Golf Monticello Minnesota United States
2426,Dimitri,Shutte,dshuttebt@etsy.com,Male,218.168.176.184,Merry Memphis Tennessee United States
2427,Alaster,Edward,aedwardbu@mail.ru,Male,231.253.78.178,Ridgeway Chicago Illinois United States
2428,Amelina,Plumley,aplumleybv@tripadvisor.com,Female,55.162.130.226,Calypso Alexandria Virginia United States
2429,Pietro,Studde,pstuddebw@dion.ne.jp,Male,239.144.66.82,Anderson Lake Worth Florida United States
2430,Wyn,Scryne,wscrynebx@hostgator.com,Male,106.180.25.240,Erie Virginia Beach Virginia United States
2431,Darin,Fahey,dfaheyby@comsenz.com,Male,217.94.241.251,Scoville Saint Louis Missouri United States
2432,Melicent,Broske,mbroskebz@answers.com,Female,36.50.87.219,Arapahoe Scottsdale Arizona United States
2433,Greggory,Gwinnel,ggwinnelc0@ihg.com,Male,104.21.168.252,Riverside San Antonio Texas United States
2434,Ema,Ziemens,eziemensc1@geocities.jp,Female,30.141.229.91,Schlimgen Las Vegas Nevada United States
2435,Ford,Lambourne,flambournec2@theguardian.com,Male,50.25.251.124,Dennis Norwalk Connecticut United States
2436,Patrice,Brabban,pbrabbanc3@soundcloud.com,Female,116.43.147.38,Dawn Long Beach California United States
2437,Claiborne,Lennox,clennoxc4@wsj.com,Male,132.43.209.168,Spohn Arlington Texas United States
2438,Hermione,MacShirrie,hmacshirriec5@mashable.com,Female,41.40.69.61,Lawn Phoenix Arizona United States
2439,Ertha,Cousens,ecousensc6@booking.com,Female,241.148.44.30,Anthes Silver Spring Maryland United States
2440,Ethe,Halliburton,ehalliburtonc7@amazon.com,Male,153.191.110.14,Summit Canton Ohio United States
2441,Gaylor,Hanbidge,ghanbidgec8@tripod.com,Male,216.120.243.179,Waubesa Seattle Washington United States
2442,Bobbi,Baise,bbaisec9@ycombinator.com,Female,193.193.115.166,Lawn Honolulu Hawaii United States
2443,Callie,Coultas,ccoultasca@163.com,Female,95.30.247.60,Meadow Vale Charleston West Virginia United States
2444,Constantin,Kingswood,ckingswoodcb@hubpages.com,Male,47.204.99.32,Fair Oaks Fort Worth Texas United States
2445,Jacintha,Roset,jrosetcc@google.es,Female,185.119.200.169,Mariners Cove Denver Colorado United States
2446,Johny,Enns,jennscd@example.com,Male,9.240.195.117,Southridge Oakland California United States
2447,Gerladina,Cicutto,gcicuttoce@mtv.com,Female,98.95.176.7,Menomonie Kansas City Missouri United States
2448,Tobey,Yakebowitch,tyakebowitchcf@t.co,Female,228.107.88.63,1st San Francisco California United States
2449,Jolie,Earthfield,jearthfieldcg@e-recht24.de,Female,172.206.176.18,Mesta Dallas Texas United States
2450,Kennith,Gowman,kgowmanch@tuttocitta.it,Male,46.18.112.231,Gale Sacramento California United States
2451,Coleman,Bagot,cbagotci@nba.com,Male,210.209.198.247,Fremont Portland Oregon United States
2452,Nelie,Vaughton,nvaughtoncj@weibo.com,Female,139.158.129.112,Weeping Birch Washington District of Columbia United States
2453,Albie,Wandless,awandlessck@theatlantic.com,Male,96.170.110.189,Dovetail Carol Stream Illinois United States
2454,Durand,Cobbledick,dcobbledickcl@mashable.com,Male,86.20.116.27,Cody Sacramento California United States
2455,Selie,Ralton,sraltoncm@google.ru,Female,73.198.45.193,Spohn Greensboro North Carolina United States
2456,Candis,Lindenblatt,clindenblattcn@so-net.ne.jp,Female,169.37.73.190,Bunker Hill Lubbock Texas United States
2457,Claresta,Bog,cbogco@meetup.com,Female,91.172.213.65,Lighthouse Bay Cincinnati Ohio United States
2458,Janette,Garrals,jgarralscp@answers.com,Female,110.62.223.6,Glendale Minneapolis Minnesota United States
2459,Andy,Mattacks,amattackscq@ucla.edu,Male,175.122.140.97,Pankratz Houston Texas United States
2460,Des,Lamlin,dlamlincr@blogger.com,Male,150.130.232.113,Scofield Montgomery Alabama United States
2461,Christi,Renyard,crenyardcs@nytimes.com,Female,55.214.101.28,Evergreen Stamford Connecticut United States
2462,Dougie,Corbet,dcorbetct@oakley.com,Male,29.129.95.188,North Oakland California United States
2463,Lilias,Eite,leitecu@quantcast.com,Female,80.201.48.232,Randy Plano Texas United States
2464,Laurena,Giraudat,lgiraudatcv@house.gov,Female,70.187.36.8,Cherokee Aurora Illinois United States
2465,Dyna,Swyer-Sexey,dswyersexeycw@ucsd.edu,Female,192.58.130.179,Gale Dayton Ohio United States
2466,Valentin,Camings,vcamingscx@wunderground.com,Male,177.72.134.143,Stang Detroit Michigan United States
2467,Romeo,Prowting,rprowtingcy@bluehost.com,Male,70.143.106.115,Cambridge Toledo Ohio United States
2468,Zaria,Pioch,zpiochcz@hao123.com,Female,169.155.209.112,Briar Crest Tallahassee Florida United States
2469,Elva,Malicki,emalickid0@chron.com,Female,121.48.21.244,American Ash Charleston South Carolina United States
2470,Weber,Ede,weded1@wikimedia.org,Male,250.219.234.184,Thierer Cleveland Ohio United States
2471,Sylvia,Knight,sknightd2@merriam-webster.com,Female,82.33.254.192,Sunnyside Sacramento California United States
2472,Talyah,Restieaux,trestieauxd3@apple.com,Female,36.140.215.26,Hanover Washington District of Columbia United States
2473,Cass,Cristofvao,ccristofvaod4@ustream.tv,Female,198.105.36.178,Annamark West Palm Beach Florida United States
2474,Cristi,Greves,cgrevesd5@php.net,Female,13.158.235.97,Cambridge Washington District of Columbia United States
2475,Margot,Moxham,mmoxhamd6@scientificamerican.com,Female,112.242.189.65,Dunning Loretto Minnesota United States
2476,Leonanie,Stuckow,lstuckowd7@godaddy.com,Female,112.154.42.119,Bayside Omaha Nebraska United States
2477,Hamel,Borlease,hborleased8@posterous.com,Male,152.77.92.8,Scofield Indianapolis Indiana United States
