id,first_name,last_name,email,gender,ip_address,address
1,Pattin,Skydall,pskydall0@squarespace.com,Male,118.244.211.39,Anzinger Utica New York United States
2,Zondra,Rubinivitz,zrubinivitz1@privacy.gov.au,Female,62.154.228.168,Dixon Manchester New Hampshire United States
3,Dud,Cobbin,dcobbin2@senate.gov,Male,164.184.55.162,Autumn Leaf Vienna Virginia United States
4,Emmerich,Marini,emarini3@nasa.gov,Male,51.139.43.197,Golf San Antonio Texas United States
5,Winni,Meijer,wmeijer4@mashable.com,Female,244.46.163.217,Butterfield Tucson Arizona United States
6,Lorin,Baiss,lbaiss5@canalblog.com,Male,183.49.219.212,Daystar San Jose California United States
7,Lin,Kos,lkos6@ezinearticles.com,Female,196.206.165.212,Sage Dallas Texas United States
8,Adolphe,Grandison,agrandison7@last.fm,Male,117.247.56.231,Fairfield Daytona Beach Florida United States
9,Elsinore,Ugoni,eugoni8@woothemes.com,Female,11.14.133.230,Ryan Saint Louis Missouri United States
10,Jeth,Brahms,jbrahms9@sogou.com,Male,227.248.124.193,Artisan Richmond Virginia United States
11,Peter,Catmull,pcatmulla@ask.com,Male,75.164.91.73,Westend Hampton Virginia United States
12,Annnora,Stenner,astennerb@walmart.com,Female,87.254.18.133,Killdeer Saint Louis Missouri United States
13,Morton,Hamnett,mhamnettc@wikispaces.com,Male,252.98.154.234,Pepper Wood Scranton Pennsylvania United States
14,Beverie,Haythorn,bhaythornd@ucoz.com,Female,136.184.190.29,Springs Mc Keesport Pennsylvania United States
15,Horst,Skirven,hskirvene@statcounter.com,Male,164.26.231.54,Main Des Moines Iowa United States
16,Korie,Elfitt,kelfittf@globo.com,Female,33.66.251.118,Fuller Fort Lauderdale Florida United States
17,Karin,MacKonochie,kmackonochieg@unesco.org,Female,173.229.95.160,John Wall Milwaukee Wisconsin United States
18,Kip,Brewett,kbrewetth@usda.gov,Female,121.26.149.8,1st Fort Lauderdale Florida United States
19,Orrin,Emlin,oemlini@ted.com,Male,164.183.97.58,Knutson Charleston West Virginia United States
20,Elana,Theobold,etheoboldj@miibeian.gov.cn,Female,195.90.228.170,Marquette Colorado Springs Colorado United States
21,Stephie,Saffon,ssaffonk@irs.gov,Female,75.171.222.184,Judy Toledo Ohio United States
22,Tarra,Dare,tdarel@mtv.com,Female,39.241.97.133,Bluejay Topeka Kansas United States
23,Romona,Deakes,rdeakesm@comsenz.com,Female,30.38.113.10,Tennyson Syracuse New York United States
24,Pam,Fleckney,pfleckneyn@mail.ru,Female,115.144.8.13,Morrow Jacksonville Florida United States
25,Kalli,Miall,kmiallo@cdc.gov,Female,56.93.142.141,Beilfuss Baltimore Maryland United States
26,Meryl,Dyet,mdyetp@google.ca,Female,90.71.246.83,Spaight Gastonia North Carolina United States
27,Evie,Abade,eabadeq@techcrunch.com,Female,24.90.108.17,Northport Denver Colorado United States
28,Wallis,Olyet,wolyetr@unblog.fr,Female,242.17.15.233,Amoth Washington District of Columbia United States
29,Drusie,Connaughton,dconnaughtons@yolasite.com,Female,23.165.130.191,Banding New York City New York United States
30,Tate,Adamolli,tadamollit@economist.com,Female,216.17.245.89,Laurel Jackson Mississippi United States
31,Theodore,Trethowan,ttrethowanu@prnewswire.com,Male,107.69.104.165,Southridge Frankfort Kentucky United States
32,Fredric,Patise,fpatisev@uol.com.br,Male,56.67.168.228,Cottonwood Whittier California United States
33,Corabelle,Woodus,cwoodusw@4shared.com,Female,51.64.98.81,Lyons College Station Texas United States
34,Pepe,O' Liddy,poliddyx@thetimes.co.uk,Male,42.39.166.112,Dovetail Boise Idaho United States
35,Konstance,Pattinson,kpattinsony@simplemachines.org,Female,104.127.197.65,Sheridan Bronx New York United States
36,Loree,Scryne,lscrynez@imgur.com,Female,61.32.243.51,Acker Philadelphia Pennsylvania United States
37,Ellsworth,Happer,ehapper10@4shared.com,Male,176.46.83.209,Cambridge Seattle Washington United States
38,Rollins,Keller,rkeller11@ebay.com,Male,145.191.106.54,Glendale Memphis Tennessee United States
39,Travis,Gutowski,tgutowski12@state.gov,Male,129.61.195.212,Nelson Montgomery Alabama United States
40,Olly,Brogioni,obrogioni13@usnews.com,Male,25.208.137.248,Luster Texarkana Texas United States
41,Lanita,Degoix,ldegoix14@tiny.cc,Female,218.91.242.14,Toban Aurora Illinois United States
42,Eduard,Lutton,elutton15@goo.gl,Male,250.12.198.57,Thompson Olympia Washington United States
43,Frans,Petschelt,fpetschelt16@ycombinator.com,Male,4.89.8.201,Anthes Syracuse New York United States
44,Atalanta,Raylton,araylton17@gmpg.org,Female,25.44.46.44,High Crossing New York City New York United States
45,Julio,Crichmere,jcrichmere18@nytimes.com,Male,161.222.145.137,Oneill Phoenix Arizona United States
46,Ilse,Sanches,isanches19@360.cn,Female,241.120.29.160,Logan Columbus Ohio United States
47,Emilia,Mishaw,emishaw1a@wikimedia.org,Female,65.185.33.212,Ridgeway Charleston South Carolina United States
48,Temple,Reinert,treinert1b@i2i.jp,Male,198.41.40.219,Northland Houston Texas United States
49,Jenine,Yetts,jyetts1c@bloglines.com,Female,180.132.57.181,International Philadelphia Pennsylvania United States
50,Currie,Bourgour,cbourgour1d@plala.or.jp,Male,99.152.241.164,Annamark Los Angeles California United States
51,Robby,Kerwen,rkerwen1e@eepurl.com,Male,148.244.167.159,Fairview Sacramento California United States
52,Jarrod,McVie,jmcvie1f@usda.gov,Male,134.87.168.219,Gina Fort Smith Arkansas United States
53,Laetitia,Seers,lseers1g@google.ca,Female,147.181.140.198,Waxwing Colorado Springs Colorado United States
54,Lise,Fleischer,lfleischer1h@jugem.jp,Female,153.232.159.90,Jackson Rochester New York United States
55,Christoforo,Whaplington,cwhaplington1i@uiuc.edu,Male,50.160.55.152,Holy Cross Nashville Tennessee United States
56,Terese,Maffy,tmaffy1j@illinois.edu,Female,225.218.74.15,Heffernan Columbus Ohio United States
57,Adelbert,Scad,ascad1k@unc.edu,Male,48.87.116.84,Anzinger El Paso Texas United States
58,Zsazsa,Ellcock,zellcock1l@chronoengine.com,Female,239.57.83.29,Londonderry San Francisco California United States
59,Nicolis,Wingfield,nwingfield1m@friendfeed.com,Male,25.157.109.84,Fremont Indianapolis Indiana United States
60,Harwell,Paintain,hpaintain1n@google.com,Male,81.242.133.65,Oxford Saint Paul Minnesota United States
61,Terrance,Eldered,teldered1o@freewebs.com,Male,17.210.41.76,Pearson Sacramento California United States
62,Lusa,Farrer,lfarrer1p@msu.edu,Female,107.28.214.123,Oriole Boston Massachusetts United States
63,Charmane,Loxton,cloxton1q@unicef.org,Female,241.88.160.7,Moose Salinas California United States
64,Cam,Nan Carrow,cnancarrow1r@pcworld.com,Male,72.157.217.173,Tony Saint Louis Missouri United States
65,Anabella,Atkins,aatkins1s@wikia.com,Female,20.160.112.156,Mariners Cove Ogden Utah United States
66,Knox,Dyett,kdyett1t@columbia.edu,Male,73.220.157.226,Sauthoff Glendale Arizona United States
67,Ingemar,Hebblewhite,ihebblewhite1u@w3.org,Male,175.95.107.51,Dunning Omaha Nebraska United States
68,Hetti,Stollmeier,hstollmeier1v@ask.com,Female,22.127.129.39,Sunfield Portland Oregon United States
69,Tom,Gutcher,tgutcher1w@gravatar.com,Male,188.22.222.201,Buena Vista Mobile Alabama United States
70,Agustin,Torrie,atorrie1x@ocn.ne.jp,Male,240.182.223.125,Monica Alexandria Louisiana United States
71,Bellanca,Dainton,bdainton1y@gravatar.com,Female,208.75.32.254,Sycamore Des Moines Iowa United States
72,Nick,Reck,nreck1z@bluehost.com,Male,50.208.141.44,Doe Crossing Ocala Florida United States
73,Silvia,Valentino,svalentino20@dagondesign.com,Female,118.150.111.222,Transport Indianapolis Indiana United States
74,Glenn,Tobin,gtobin21@ezinearticles.com,Male,58.57.160.1,Northfield Santa Fe New Mexico United States
75,Tanya,Whoolehan,twhoolehan22@apache.org,Female,85.77.16.170,Lerdahl Jeffersonville Indiana United States
76,Bartlet,Kybird,bkybird23@macromedia.com,Male,20.86.69.246,Westerfield Marietta Georgia United States
77,Sanford,Raffels,sraffels24@nationalgeographic.com,Male,252.60.75.179,Annamark Stockton California United States
78,Pavel,Hug,phug25@amazon.com,Male,202.86.65.194,Saint Paul Corpus Christi Texas United States
79,Basia,Probey,bprobey26@mozilla.org,Female,210.28.163.73,Duke Bridgeport Connecticut United States
80,Debora,Quadri,dquadri27@behance.net,Female,250.3.34.22,Transport Lake Charles Louisiana United States
81,Chucho,Germann,cgermann28@exblog.jp,Male,41.245.14.11,Dapin Baltimore Maryland United States
82,Lambert,Fidgeon,lfidgeon29@amazon.co.jp,Male,142.181.73.232,Porter Washington District of Columbia United States
83,Happy,Bruckent,hbruckent2a@webs.com,Female,162.18.226.73,Larry Springfield Massachusetts United States
84,Allayne,Sommer,asommer2b@friendfeed.com,Male,170.181.183.3,Waywood Orange California United States
85,Diena,Yashin,dyashin2c@businessweek.com,Female,182.48.170.53,Haas Memphis Tennessee United States
86,Theodora,McCurt,tmccurt2d@soup.io,Female,244.134.91.94,Hanson Birmingham Alabama United States
87,Germayne,Bentall,gbentall2e@i2i.jp,Male,157.193.204.182,Oneill Tucson Arizona United States
88,Archer,Abramowsky,aabramowsky2f@issuu.com,Male,230.117.61.182,Tennessee Buffalo New York United States
89,Jolene,Oakwell,joakwell2g@odnoklassniki.ru,Female,0.173.66.23,Lillian Brockton Massachusetts United States
90,Ezekiel,Semeradova,esemeradova2h@nasa.gov,Male,243.179.90.136,Crowley Orlando Florida United States
91,Nadeen,Verson,nverson2i@unc.edu,Female,52.10.252.211,Brentwood North Hollywood California United States
92,Xylia,MacFadyen,xmacfadyen2j@slideshare.net,Female,215.35.85.58,Aberg Panama City Florida United States
93,Kippy,Labden,klabden2k@icio.us,Female,119.162.208.121,Anderson Carson City Nevada United States
94,Townsend,Mariault,tmariault2l@moonfruit.com,Male,122.251.78.51,Di Loreto Grand Rapids Michigan United States
95,Kessia,Baulk,kbaulk2m@topsy.com,Female,132.188.102.123,Lillian San Jose California United States
96,Katherine,Bale,kbale2n@newyorker.com,Female,182.202.88.0,Shoshone San Antonio Texas United States
97,Allison,Haken,ahaken2o@bravesites.com,Female,176.27.46.133,Fairview Seattle Washington United States
98,Stanton,Hardey,shardey2p@elpais.com,Male,1.53.232.80,Melody Sacramento California United States
99,Leandra,Deddum,ldeddum2q@gnu.org,Female,106.67.68.103,Goodland Sioux City Iowa United States
100,Mignonne,Fairhurst,mfairhurst2r@java.com,Female,36.99.172.166,Comanche Murfreesboro Tennessee United States
101,Gualterio,Andrzejewski,gandrzejewski2s@samsung.com,Male,127.68.163.25,Garrison New Castle Pennsylvania United States
102,Arne,Tampling,atampling2t@wsj.com,Male,247.50.209.9,Hayes Tulsa Oklahoma United States
103,Almire,McGurgan,amcgurgan2u@mayoclinic.com,Female,233.197.164.181,Dahle York Pennsylvania United States
104,Chaim,Cressy,ccressy2v@europa.eu,Male,164.122.26.77,Saint Paul Trenton New Jersey United States
105,Rozanna,Wavell,rwavell2w@gov.uk,Female,251.239.122.225,Little Fleur Orlando Florida United States
106,Hyacintha,Kindle,hkindle2x@dropbox.com,Female,60.86.119.153,Portage Omaha Nebraska United States
107,Noelani,Doud,ndoud2y@oakley.com,Female,55.236.92.151,Mayfield Clearwater Florida United States
108,Romy,Queree,rqueree2z@wikimedia.org,Female,149.65.218.154,Ryan Arlington Texas United States
109,Lesley,Cavozzi,lcavozzi30@123-reg.co.uk,Male,245.253.25.186,Fairview Colorado Springs Colorado United States
110,Kelci,Ferrea,kferrea31@exblog.jp,Female,255.201.255.14,Comanche Atlanta Georgia United States
111,Katina,Coughtrey,kcoughtrey32@umich.edu,Female,239.114.196.49,Briar Crest Virginia Beach Virginia United States
112,Gwendolyn,Brobak,gbrobak33@qq.com,Female,166.237.87.4,Green Tampa Florida United States
113,Teena,Sesser,tsesser34@hostgator.com,Female,175.54.194.7,Farmco Atlanta Georgia United States
114,Sharl,McConnel,smcconnel35@privacy.gov.au,Female,113.22.216.223,Paget Atlanta Georgia United States
115,Adah,Sopp,asopp36@google.com.hk,Female,161.119.195.214,Corry Austin Texas United States
116,Archie,Agg,aagg37@omniture.com,Male,104.111.237.42,Northview Stamford Connecticut United States
117,Anthiathia,Iddy,aiddy38@wsj.com,Female,186.239.37.10,Badeau Cleveland Ohio United States
118,Zackariah,Oxtarby,zoxtarby39@gravatar.com,Male,238.12.171.183,Everett Beaverton Oregon United States
119,Benedicto,Reicherz,breicherz3a@google.co.uk,Male,54.162.202.213,Victoria Bethesda Maryland United States
120,Shanon,Bodimeade,sbodimeade3b@springer.com,Female,12.160.175.103,Sunbrook Colorado Springs Colorado United States
121,Judas,Sands,jsands3c@soup.io,Male,89.191.75.208,Washington Bakersfield California United States
122,Cordey,Farron,cfarron3d@japanpost.jp,Female,128.254.205.125,Maple Young America Minnesota United States
123,Lucky,Farran,lfarran3e@prlog.org,Female,164.226.97.139,Sutherland Warren Ohio United States
124,Rollo,Gahagan,rgahagan3f@sbwire.com,Male,63.20.184.246,Northview Houston Texas United States
125,Garrett,Shannahan,gshannahan3g@scribd.com,Male,246.63.130.12,Commercial New Orleans Louisiana United States
126,Gayle,Tippings,gtippings3h@paypal.com,Male,28.28.181.203,Clyde Gallagher Pittsburgh Pennsylvania United States
127,Mil,Needham,mneedham3i@pcworld.com,Female,154.140.30.243,Blaine Champaign Illinois United States
128,Cesar,Vasin,cvasin3j@163.com,Male,0.67.245.72,David Portland Oregon United States
129,Morris,Bentham,mbentham3k@com.com,Male,154.68.35.251,Lillian Billings Montana United States
130,Anatole,Shreenan,ashreenan3l@sina.com.cn,Male,83.237.87.34,Almo El Paso Texas United States
131,Burlie,Giorgioni,bgiorgioni3m@nature.com,Male,250.23.103.3,Dayton Fresno California United States
132,Michell,Dripp,mdripp3n@marketwatch.com,Female,2.82.44.191,Ludington Lafayette Louisiana United States
133,Scottie,Mawdsley,smawdsley3o@facebook.com,Male,79.25.48.206,Dakota Ogden Utah United States
134,Ophelie,Martinolli,omartinolli3p@aboutads.info,Female,220.56.113.226,Bellgrove Pocatello Idaho United States
135,Andres,Hudghton,ahudghton3q@earthlink.net,Male,158.211.234.155,Oak Pueblo Colorado United States
136,Clareta,Monks,cmonks3r@sakura.ne.jp,Female,33.35.219.137,Michigan San Francisco California United States
137,Stavro,Berthome,sberthome3s@europa.eu,Male,12.199.231.83,Springview Cincinnati Ohio United States
138,Fania,Harley,fharley3t@nasa.gov,Female,75.70.72.85,Center New York City New York United States
139,Leonidas,Santostefano.,lsantostefano3u@barnesandnoble.com,Male,183.139.182.164,Butternut Brooklyn New York United States
140,Willard,Metcalfe,wmetcalfe3v@a8.net,Male,134.115.122.184,Mayer Corpus Christi Texas United States
141,Arleyne,Lown,alown3w@unc.edu,Female,112.211.109.46,Orin Vancouver Washington United States
142,Olivia,Franklin,ofranklin3x@bizjournals.com,Female,160.244.70.161,Debs Reading Pennsylvania United States
143,Riobard,Maulin,rmaulin3y@lycos.com,Male,92.251.27.32,Warrior Crawfordsville Indiana United States
144,Pearl,Scatchard,pscatchard3z@noaa.gov,Female,205.19.183.213,Logan Austin Texas United States
145,Janeva,Costan,jcostan40@usa.gov,Female,91.242.35.140,Brentwood Glendale California United States
146,Bartlett,Isles,bisles41@craigslist.org,Male,21.164.211.146,Graedel South Bend Indiana United States
147,Biddie,Tabourel,btabourel42@liveinternet.ru,Female,170.125.12.172,Bluejay Boise Idaho United States
148,Tomas,Uzielli,tuzielli43@google.es,Male,237.9.167.38,Morningstar Seattle Washington United States
149,Agnese,Joynson,ajoynson44@newsvine.com,Female,171.179.76.158,Springview Virginia Beach Virginia United States
150,Dena,Witherby,dwitherby45@adobe.com,Female,175.154.195.176,Milwaukee Pinellas Park Florida United States
151,Glennis,Epinoy,gepinoy46@prweb.com,Female,244.56.75.62,Garrison Norcross Georgia United States
152,Coop,Rosencwaig,crosencwaig47@weather.com,Male,211.177.27.161,Spaight Flint Michigan United States
153,Jeanne,Hastilow,jhastilow48@163.com,Female,251.166.132.62,Steensland Norfolk Virginia United States
154,Hedi,De Gregario,hdegregario49@tmall.com,Female,232.136.244.149,Delaware Saint Louis Missouri United States
155,Kennith,Kilvington,kkilvington4a@phpbb.com,Male,62.92.197.159,Pond Homestead Florida United States
156,Alix,Moreside,amoreside4b@time.com,Male,238.194.165.175,Petterle Port Washington New York United States
157,Dimitry,Silversmid,dsilversmid4c@va.gov,Male,135.92.160.164,Raven Lawrenceville Georgia United States
158,Nomi,Greatland,ngreatland4d@cnet.com,Female,11.51.214.69,Texas Monroe Louisiana United States
159,Cassaundra,Steddall,csteddall4e@cyberchimps.com,Female,228.234.211.129,Prairie Rose El Paso Texas United States
160,Ania,Mapes,amapes4f@vkontakte.ru,Female,35.15.239.15,Mockingbird Pittsburgh Pennsylvania United States
161,Gloria,Smead,gsmead4g@simplemachines.org,Female,204.30.216.181,Maryland Newton Massachusetts United States
162,Lavina,Ciccottini,lciccottini4h@addthis.com,Female,142.246.184.48,Forest Chattanooga Tennessee United States
163,Cordy,Sykora,csykora4i@wiley.com,Female,86.65.176.108,Sunbrook Anchorage Alaska United States
164,Avivah,Gammack,agammack4j@usatoday.com,Female,231.11.129.176,Graceland Fredericksburg Virginia United States
165,Leela,Keable,lkeable4k@bbc.co.uk,Female,30.164.147.246,Prentice Orange California United States
166,Radcliffe,Tatchell,rtatchell4l@mysql.com,Male,254.239.224.14,Old Gate Sacramento California United States
167,Blinnie,Ghiroldi,bghiroldi4m@cornell.edu,Female,213.203.181.188,Autumn Leaf Anchorage Alaska United States
168,Spenser,Drinkall,sdrinkall4n@mail.ru,Male,233.49.185.186,Oak Valley Katy Texas United States
169,Aldridge,Motton,amotton4o@irs.gov,Male,142.72.128.187,Donald Garland Texas United States
170,Raychel,Harmston,rharmston4p@aol.com,Female,4.37.140.223,Morrow Sacramento California United States
171,Tiffie,Gabby,tgabby4q@reuters.com,Female,97.190.116.138,Sunfield Dallas Texas United States
172,Karlens,Sulter,ksulter4r@army.mil,Male,12.93.247.152,Prairieview Albuquerque New Mexico United States
173,Grady,Oakenfield,goakenfield4s@alexa.com,Male,35.176.157.85,Oakridge Richmond Virginia United States
174,Eugen,Frenzl,efrenzl4t@cloudflare.com,Male,60.28.121.98,Sachs Washington District of Columbia United States
175,Mickey,Talkington,mtalkington4u@skype.com,Male,93.125.202.165,Glacier Hill Scottsdale Arizona United States
176,Wallis,Rops,wrops4v@baidu.com,Male,28.73.53.214,Annamark Salt Lake City Utah United States
177,Tedda,Marriot,tmarriot4w@123-reg.co.uk,Female,193.101.228.144,Fieldstone Seattle Washington United States
178,Shirlee,Gullefant,sgullefant4x@va.gov,Female,23.151.3.127,Eastwood Baltimore Maryland United States
179,Sayre,Butner,sbutner4y@dailymotion.com,Male,165.114.105.197,Mccormick Naples Florida United States
180,Newton,Amoss,namoss4z@yellowbook.com,Male,28.43.161.160,Birchwood Portland Oregon United States
181,Jinny,Mundie,jmundie50@toplist.cz,Female,21.161.195.32,Dexter Philadelphia Pennsylvania United States
182,Garreth,Gisburne,ggisburne51@archive.org,Male,143.238.122.22,Haas Bronx New York United States
183,Frazier,McQuode,fmcquode52@oracle.com,Male,107.236.19.65,Kipling Long Beach California United States
184,Phaedra,Campey,pcampey53@shareasale.com,Female,194.81.109.255,Magdeline Seattle Washington United States
185,Jessy,Scirman,jscirman54@g.co,Female,123.108.46.73,Vernon San Antonio Texas United States
186,Britte,Samms,bsamms55@shareasale.com,Female,46.148.238.37,Londonderry San Francisco California United States
187,Galvan,Hellmer,ghellmer56@npr.org,Male,185.49.50.126,Northland Brockton Massachusetts United States
188,Tracey,Troup,ttroup57@github.io,Male,196.129.173.157,Stang Topeka Kansas United States
189,Jessee,Walster,jwalster58@typepad.com,Male,73.40.187.128,Sommers Bakersfield California United States
190,Skell,Eighteen,seighteen59@dagondesign.com,Male,238.74.65.237,Anderson Oklahoma City Oklahoma United States
191,Quinn,Beamish,qbeamish5a@wikimedia.org,Female,228.88.122.187,Burning Wood Saint Paul Minnesota United States
192,Judye,Banghe,jbanghe5b@earthlink.net,Female,195.243.98.187,Golf Hartford Connecticut United States
193,Basilius,Element,belement5c@npr.org,Male,240.117.42.248,Green Ridge Orlando Florida United States
194,Pryce,Jovey,pjovey5d@wufoo.com,Male,212.243.187.104,Boyd Garland Texas United States
195,Haskell,Shobbrook,hshobbrook5e@technorati.com,Male,188.235.29.28,Stephen Jamaica New York United States
196,Zenia,Biddulph,zbiddulph5f@devhub.com,Female,23.187.50.196,Nevada Albuquerque New Mexico United States
197,Aymer,Triggel,atriggel5g@paginegialle.it,Male,126.22.57.223,Lyons Salt Lake City Utah United States
198,Sandi,Preist,spreist5h@engadget.com,Female,189.50.175.216,Hollow Ridge Dallas Texas United States
199,Ariana,Shortcliffe,ashortcliffe5i@house.gov,Female,117.28.51.8,Beilfuss Kansas City Missouri United States
200,Abramo,Borges,aborges5j@wikimedia.org,Male,133.13.216.6,Linden Pittsburgh Pennsylvania United States
201,Annamaria,Pimblett,apimblett5k@1688.com,Female,46.166.17.132,Kropf Saint Louis Missouri United States
202,Dalia,Romayn,dromayn5l@newyorker.com,Female,252.212.182.172,Stone Corner Chicago Illinois United States
203,Renault,Dulanty,rdulanty5m@aol.com,Male,97.5.164.94,Carey Young America Minnesota United States
204,Katharina,Pilpovic,kpilpovic5n@cyberchimps.com,Female,76.188.190.3,Sundown Miami Florida United States
205,Jud,Andrichuk,jandrichuk5o@photobucket.com,Male,8.123.202.177,Pleasure Sacramento California United States
206,Audre,Mulqueeny,amulqueeny5p@yandex.ru,Female,208.225.221.252,Sugar Southfield Michigan United States
207,Lira,Quarrington,lquarrington5q@wordpress.org,Female,67.43.52.5,Spaight Hagerstown Maryland United States
208,Freedman,Roussel,froussel5r@indiegogo.com,Male,87.68.236.119,Lakewood Gainesville Florida United States
209,Ariela,Bosquet,abosquet5s@tuttocitta.it,Female,55.118.139.146,Birchwood Zephyrhills Florida United States
210,Patrizius,Critten,pcritten5t@baidu.com,Male,160.136.74.195,Rigney Flushing New York United States
211,Pammy,Barwood,pbarwood5u@stanford.edu,Female,185.210.165.45,Tony Peoria Illinois United States
212,Frannie,Stower,fstower5v@apache.org,Female,197.136.77.241,Briar Crest Miami Florida United States
213,Anna-diana,Duckels,aduckels5w@so-net.ne.jp,Female,9.218.50.66,Rusk Jacksonville Florida United States
214,Pernell,Stockings,pstockings5x@mayoclinic.com,Male,70.214.152.6,Luster New York City New York United States
215,Domini,Glasbey,dglasbey5y@parallels.com,Female,172.241.96.17,Ramsey Jacksonville Florida United States
216,Johnnie,Beckhouse,jbeckhouse5z@sina.com.cn,Male,166.182.76.43,Express Santa Fe New Mexico United States
217,Carola,Gouldeby,cgouldeby60@hp.com,Female,243.85.196.224,Heath New York City New York United States
218,Pattin,Myerscough,pmyerscough61@reference.com,Male,217.124.77.88,Jackson Colorado Springs Colorado United States
219,Currey,Siemon,csiemon62@wufoo.com,Male,207.165.232.42,7th Gulfport Mississippi United States
220,Gates,Aspinwall,gaspinwall63@adobe.com,Female,143.114.73.53,Village Green Fresno California United States
221,Louisette,Bradley,lbradley64@vinaora.com,Female,31.46.245.189,Talisman Mesa Arizona United States
222,Aloisia,Howman,ahowman65@mediafire.com,Female,179.141.13.167,Valley Edge Fresno California United States
223,Pat,Matitiaho,pmatitiaho66@technorati.com,Female,185.145.93.247,Farragut Bronx New York United States
224,Orv,Chisolm,ochisolm67@berkeley.edu,Male,179.228.24.177,West Silver Spring Maryland United States
225,Vinnie,Giovannelli,vgiovannelli68@imageshack.us,Male,196.149.12.242,Bunting Dallas Texas United States
226,Gladys,Cohan,gcohan69@google.nl,Female,142.123.148.37,Farragut Stockton California United States
227,Glynnis,Wedlock,gwedlock6a@dell.com,Female,198.187.188.123,Daystar Canton Ohio United States
228,Simonne,Darlison,sdarlison6b@cyberchimps.com,Female,40.17.231.36,Bobwhite Beaumont Texas United States
229,Pavia,Capaldo,pcapaldo6c@ow.ly,Female,247.155.14.130,Grover Bryan Texas United States
230,Justina,Kendle,jkendle6d@free.fr,Female,7.64.178.135,Hudson Herndon Virginia United States
231,Adi,Klimentov,aklimentov6e@amazon.co.uk,Female,176.12.177.0,Maple Wood Richmond Virginia United States
232,Hersch,Folkerd,hfolkerd6f@twitter.com,Male,52.35.188.250,Kennedy Sacramento California United States
233,Mahalia,Heardman,mheardman6g@miitbeian.gov.cn,Female,237.122.117.52,International Columbia South Carolina United States
234,Dillon,Beevor,dbeevor6h@linkedin.com,Male,16.66.139.245,Roxbury Northridge California United States
235,Feodora,Bertwistle,fbertwistle6i@berkeley.edu,Female,252.247.253.58,Mesta Miami Florida United States
236,Abie,Dowdney,adowdney6j@topsy.com,Male,242.25.131.71,Norway Maple Tucson Arizona United States
237,Letty,Davidi,ldavidi6k@accuweather.com,Female,103.185.249.208,Di Loreto Norwalk Connecticut United States
238,Emelina,Kernocke,ekernocke6l@tumblr.com,Female,167.157.0.23,Anzinger Columbus Ohio United States
239,Theda,Sachno,tsachno6m@timesonline.co.uk,Female,253.205.48.178,Pawling Tampa Florida United States
240,Garv,Kingscote,gkingscote6n@dailymail.co.uk,Male,97.141.207.176,Nancy Bakersfield California United States
241,Roseanna,Goreisr,rgoreisr6o@cloudflare.com,Female,53.218.122.175,Myrtle Brea California United States
242,Bentley,Jelly,bjelly6p@google.com,Male,42.59.163.248,Harbort San Antonio Texas United States
243,Curr,Itzcak,citzcak6q@nymag.com,Male,78.8.187.91,Weeping Birch Brooklyn New York United States
244,Lizabeth,Kilbee,lkilbee6r@illinois.edu,Female,218.86.22.118,Mayer Schaumburg Illinois United States
245,Emera,Wrankmore,ewrankmore6s@artisteer.com,Female,209.151.129.111,Prentice Houston Texas United States
246,Martin,Gilling,mgilling6t@godaddy.com,Male,235.203.161.65,Colorado Austin Texas United States
247,Waly,Yarrall,wyarrall6u@pcworld.com,Female,132.175.93.21,Brentwood Washington District of Columbia United States
248,Jenn,Flipek,jflipek6v@pcworld.com,Female,134.139.15.221,Fallview Atlanta Georgia United States
249,Hasheem,Siebert,hsiebert6w@de.vu,Male,73.147.4.234,Delaware Lexington Kentucky United States
250,Jacklyn,Ritchard,jritchard6x@xinhuanet.com,Female,91.210.85.57,Fremont Glendale California United States
