id,first_name,last_name,email,gender,ip_address,address
1491,Carny,Barnicott,cbarnicottdm@purevolume.com,Male,246.31.216.166,Leroy Detroit Michigan United States
1492,Kelsey,Peller,kpellerdn@comcast.net,Female,126.23.129.139,Hagan Atlanta Georgia United States
1493,Cleon,Tussaine,ctussainedo@sitemeter.com,Male,30.8.61.191,Hovde Memphis Tennessee United States
1494,Bonny,Allaway,ballawaydp@sakura.ne.jp,Female,160.176.147.189,Truax Irving Texas United States
1495,Luca,Issac,lissacdq@harvard.edu,Male,164.11.34.83,Cascade Little Rock Arkansas United States
1496,Dareen,Bushaway,dbushawaydr@wikispaces.com,Female,52.96.231.10,Pepper Wood Philadelphia Pennsylvania United States
1497,Tudor,Roloff,troloffds@theguardian.com,Male,58.135.215.19,Clyde Gallagher Richmond Virginia United States
1498,Meggy,Avon,mavondt@cocolog-nifty.com,Female,214.92.107.251,Schlimgen Albany New York United States
1499,Fina,Germaine,fgermainedu@github.io,Female,173.218.73.237,Charing Cross Carol Stream Illinois United States
1500,Isidoro,Baudains,ibaudainsdv@storify.com,Male,186.232.42.152,Dorton Huntington West Virginia United States
1501,Pail,Woodyear,pwoodyeardw@ustream.tv,Male,214.81.39.42,Mendota Albuquerque New Mexico United States
1502,Laurie,Alenin,lalenindx@earthlink.net,Female,186.50.23.91,Arapahoe Canton Ohio United States
1503,Dory,Coonihan,dcoonihandy@si.edu,Male,183.5.223.126,Lindbergh San Mateo California United States
1504,Antons,Dietmar,adietmardz@ustream.tv,Male,63.239.203.249,Fordem Newark Delaware United States
1505,Fernande,Elnor,felnore0@facebook.com,Female,100.114.191.159,Roth Portland Oregon United States
1506,Kacy,Boswood,kboswoode1@constantcontact.com,Female,122.136.112.67,Dwight Jacksonville Florida United States
1507,Stearn,Tzuker,stzukere2@pagesperso-orange.fr,Male,84.48.1.50,East Bridgeport Connecticut United States
1508,Jocko,Feasby,jfeasbye3@networkadvertising.org,Male,58.241.170.27,Kim Memphis Tennessee United States
1509,Emmett,Acheson,eachesone4@clickbank.net,Male,197.73.164.173,Cherokee Bridgeport Connecticut United States
1510,Roderich,Axelbey,raxelbeye5@tiny.cc,Male,33.81.19.118,Marquette Atlanta Georgia United States
1511,Barn,Monger,bmongere6@accuweather.com,Male,3.226.176.176,Golf View Billings Montana United States
1512,Ranice,Hurles,rhurlese7@ezinearticles.com,Female,208.117.137.126,Cascade Vero Beach Florida United States
1513,Zollie,Tutchings,ztutchingse8@dagondesign.com,Male,22.67.146.149,Ronald Regan Detroit Michigan United States
1514,Merline,Lyste,mlystee9@tinyurl.com,Female,19.220.141.87,Old Shore Salt Lake City Utah United States
1515,Adrienne,Boarleyson,aboarleysonea@mapy.cz,Female,35.235.61.239,Buhler Houston Texas United States
1516,Morlee,Bazire,mbazireeb@yelp.com,Male,112.74.126.179,Westend Newton Massachusetts United States
1517,Evvy,Olpin,eolpinec@wp.com,Female,229.62.241.165,Troy Pasadena California United States
1518,Duffie,Warin,dwarined@pinterest.com,Male,125.2.122.138,Portage Jacksonville Florida United States
1519,Joelle,Addicott,jaddicottee@theatlantic.com,Female,154.222.9.185,Fulton Lees Summit Missouri United States
1520,Truda,Rubenchik,trubenchikef@theguardian.com,Female,100.4.9.228,Stoughton Anderson South Carolina United States
1521,Malvin,Hassewell,mhassewelleg@businesswire.com,Male,212.112.203.82,Lighthouse Bay Toledo Ohio United States
1522,Mose,Nyssen,mnysseneh@de.vu,Male,128.143.251.86,Sage Los Angeles California United States
1523,Rogers,Mountlow,rmountlowei@yolasite.com,Male,11.155.226.101,Jenifer New York City New York United States
1524,Warde,Jeenes,wjeenesej@edublogs.org,Male,11.178.46.135,American Ash Spring Texas United States
1525,Pepita,Anfossi,panfossiek@de.vu,Female,170.147.26.111,Sachtjen Sacramento California United States
1526,Riannon,Quarlis,rquarlisel@dedecms.com,Female,186.188.110.253,Meadow Valley Warren Ohio United States
1527,Darbie,Pieche,dpiecheem@cdc.gov,Female,104.44.176.162,Eliot Indianapolis Indiana United States
1528,Uriah,Fidock,ufidocken@si.edu,Male,118.105.66.140,Gina Birmingham Alabama United States
1529,Neil,Diddams,ndiddamseo@nbcnews.com,Male,19.107.196.231,Loftsgordon Amarillo Texas United States
1530,Bob,Gillebride,bgillebrideep@webs.com,Male,148.137.221.94,Tony Lansing Michigan United States
1531,My,Tolomio,mtolomioeq@studiopress.com,Male,255.149.203.229,Stone Corner Las Vegas Nevada United States
1532,Karola,McGoogan,kmcgooganer@wufoo.com,Female,253.113.158.183,Reinke Washington District of Columbia United States
1533,Stanly,Nudde,snuddees@yellowbook.com,Male,52.213.102.45,Fairfield Amarillo Texas United States
1534,Christabella,Reaveley,creaveleyet@nymag.com,Female,33.19.169.162,Moulton New York City New York United States
1535,Harwell,Speers,hspeerseu@mediafire.com,Male,147.35.236.2,Cody Corpus Christi Texas United States
1536,Midge,Pollitt,mpollittev@pen.io,Female,153.199.97.171,Old Shore Dallas Texas United States
1537,Angel,Bortolomei,abortolomeiew@wikimedia.org,Male,31.204.251.103,Nova Ventura California United States
1538,Janeta,Peasegod,jpeasegodex@php.net,Female,168.171.55.9,Onsgard Mc Keesport Pennsylvania United States
1539,Wynne,Biswell,wbiswelley@sciencedaily.com,Female,172.185.0.121,Mallard Minneapolis Minnesota United States
1540,Cesar,Hanaford,chanafordez@usatoday.com,Male,83.175.91.111,John Wall Racine Wisconsin United States
1541,Remington,Scott,rscottf0@jimdo.com,Male,238.1.212.254,Myrtle Hartford Connecticut United States
1542,Jackie,Fitzpayn,jfitzpaynf1@yellowpages.com,Male,123.69.93.41,Roth Oklahoma City Oklahoma United States
1543,Nanny,Gavrieli,ngavrielif2@elpais.com,Female,48.48.0.234,Tomscot Washington District of Columbia United States
1544,Petronilla,Niemiec,pniemiecf3@vkontakte.ru,Female,131.8.248.252,Menomonie Allentown Pennsylvania United States
1545,Tildie,Siddons,tsiddonsf4@icio.us,Female,128.52.123.152,Kedzie Chicago Illinois United States
1546,Annecorinne,Senter,asenterf5@mayoclinic.com,Female,50.190.237.112,Comanche Mobile Alabama United States
1547,Sylvester,Hallgate,shallgatef6@1und1.de,Male,183.90.81.67,Kim Inglewood California United States
1548,Marris,Colliver,mcolliverf7@amazon.de,Female,70.24.165.87,Hanover Birmingham Alabama United States
1549,Burlie,Ovendale,bovendalef8@wix.com,Male,220.161.105.177,Rutledge Baton Rouge Louisiana United States
1550,Bevon,Sutton,bsuttonf9@netscape.com,Male,208.68.214.200,Chive Hartford Connecticut United States
1551,Estele,Jeeks,ejeeksfa@mlb.com,Female,106.16.32.21,Fieldstone New York City New York United States
1552,Kameko,O' Cloney,kocloneyfb@github.io,Female,213.227.36.226,Esker Hartford Connecticut United States
1553,Chance,McKimm,cmckimmfc@cargocollective.com,Male,96.78.72.137,Maywood Los Angeles California United States
1554,Ernst,Haack,ehaackfd@woothemes.com,Male,199.122.194.75,Del Mar Denver Colorado United States
1555,Tristam,Graddon,tgraddonfe@yale.edu,Male,122.200.205.175,Manitowish Fort Worth Texas United States
1556,Latia,Leake,lleakeff@oracle.com,Female,58.68.155.128,Spenser Winston Salem North Carolina United States
1557,Donia,Tanslie,dtansliefg@addthis.com,Female,169.185.157.202,Ramsey El Paso Texas United States
1558,Krishnah,Boots,kbootsfh@google.de,Male,0.209.30.15,Hoffman Mobile Alabama United States
1559,Aubree,Castagna,acastagnafi@histats.com,Female,43.13.165.159,Prentice Salem Oregon United States
1560,Abbey,Twohig,atwohigfj@bbc.co.uk,Male,63.55.207.62,Hooker Augusta Georgia United States
1561,Der,Clem,dclemfk@jalbum.net,Male,81.107.74.159,Maywood Nashville Tennessee United States
1562,Chad,Musk,cmuskfl@wix.com,Female,3.124.90.100,Johnson Toledo Ohio United States
1563,Kimberly,Enion,kenionfm@umich.edu,Female,62.94.199.199,Anderson Corpus Christi Texas United States
1564,Charlton,Iacovaccio,ciacovacciofn@senate.gov,Male,179.245.112.45,Ludington Washington District of Columbia United States
1565,Collie,Ives,civesfo@miibeian.gov.cn,Female,148.110.186.95,Forest Sioux Falls South Dakota United States
1566,Elora,Croom,ecroomfp@google.it,Female,190.52.50.38,Lyons Metairie Louisiana United States
1567,Paxton,Nesbeth,pnesbethfq@newyorker.com,Male,10.95.133.216,Nevada Louisville Kentucky United States
1568,Rea,Scurrer,rscurrerfr@sun.com,Female,72.172.95.114,Knutson Boise Idaho United States
1569,Kerr,Gillham,kgillhamfs@tripod.com,Male,202.11.44.95,Merchant Springfield Virginia United States
1570,Alphonse,Penritt,apenrittft@nydailynews.com,Male,19.178.61.131,Butternut Rochester New York United States
1571,Kaspar,Cotterell,kcotterellfu@loc.gov,Male,40.131.205.225,Meadow Ridge Wilkes Barre Pennsylvania United States
1572,Goldi,Murdy,gmurdyfv@jalbum.net,Female,5.124.126.221,Southridge Chicago Illinois United States
1573,Guglielmo,Elner,gelnerfw@omniture.com,Male,0.253.156.88,Onsgard Pittsburgh Pennsylvania United States
1574,Fidelia,Trenbay,ftrenbayfx@ebay.com,Female,176.234.93.207,Glendale Akron Ohio United States
1575,Lorrayne,Pennicard,lpennicardfy@economist.com,Female,57.164.139.222,Riverside Richmond Virginia United States
1576,Aubrey,Brownsell,abrownsellfz@taobao.com,Female,222.222.253.75,Sugar New Haven Connecticut United States
1577,Darill,Domico,ddomicog0@hc360.com,Male,204.249.42.74,Menomonie Salt Lake City Utah United States
1578,Chris,Tuiller,ctuillerg1@cam.ac.uk,Female,110.194.33.101,Rowland Tacoma Washington United States
1579,Darill,Camlin,dcamling2@yelp.com,Male,162.85.56.81,Ryan Hyattsville Maryland United States
1580,Der,Offill,doffillg3@virginia.edu,Male,248.246.186.59,Lien Saint Louis Missouri United States
1581,Skyler,Brute,sbruteg4@census.gov,Male,219.248.250.195,Village Fort Worth Texas United States
1582,Harriette,Weitzel,hweitzelg5@barnesandnoble.com,Female,104.193.230.212,Morning Anaheim California United States
1583,Dulcea,Longmate,dlongmateg6@homestead.com,Female,104.174.220.108,Russell Columbia South Carolina United States
1584,Jeannette,Peal,jpealg7@goo.gl,Female,250.17.249.122,Park Meadow Wilkes Barre Pennsylvania United States
1585,Brittan,Jeacock,bjeacockg8@va.gov,Female,157.23.143.183,Bobwhite Spartanburg South Carolina United States
1586,Lu,Blissitt,lblissittg9@bandcamp.com,Female,32.120.53.107,Eggendart Madison Wisconsin United States
1587,Ethelda,Dellenbach,edellenbachga@examiner.com,Female,69.249.118.127,Ludington Salt Lake City Utah United States
1588,Charmain,Bubbins,cbubbinsgb@usnews.com,Female,64.2.146.101,Forster Mesa Arizona United States
1589,Guido,Crowhurst,gcrowhurstgc@wordpress.org,Male,135.19.182.49,Westend Denver Colorado United States
1590,Tammi,Fitzmaurice,tfitzmauricegd@vimeo.com,Female,186.232.134.99,Service Sacramento California United States
1591,Tirrell,Auguste,taugustege@ed.gov,Male,97.169.92.86,Loeprich Atlanta Georgia United States
1592,Krisha,D'Alessandro,kdalessandrogf@php.net,Male,156.74.43.243,Clarendon Houston Texas United States
1593,Angelico,Halstead,ahalsteadgg@npr.org,Male,218.161.207.99,Oneill Cedar Rapids Iowa United States
1594,Nissie,Peirson,npeirsongh@army.mil,Female,102.102.84.182,Meadow Vale Texarkana Texas United States
1595,Taylor,Skillen,tskillengi@clickbank.net,Male,160.63.18.215,New Castle Terre Haute Indiana United States
1596,Heidie,MacLeod,hmacleodgj@businessinsider.com,Female,157.75.81.56,Pierstorff Honolulu Hawaii United States
1597,Alvina,Tayt,ataytgk@ask.com,Female,205.192.77.182,Shoshone Huntington West Virginia United States
1598,Randi,Densie,rdensiegl@360.cn,Female,240.180.248.255,Rockefeller Miami Florida United States
1599,Almeda,Crosse,acrossegm@omniture.com,Female,119.38.242.143,Anthes Kansas City Missouri United States
1600,Clark,Bunford,cbunfordgn@creativecommons.org,Male,43.8.96.195,Becker Youngstown Ohio United States
1601,Reg,Proswell,rproswellgo@addthis.com,Male,184.72.142.32,Lighthouse Bay Las Cruces New Mexico United States
1602,Annalise,Collum,acollumgp@mit.edu,Female,94.35.156.209,Stoughton Norfolk Virginia United States
1603,Tirrell,Adriano,tadrianogq@amazon.co.jp,Male,164.171.92.68,Onsgard Peoria Illinois United States
1604,Myrah,Losano,mlosanogr@aol.com,Female,15.27.103.50,Goodland Norfolk Virginia United States
1605,Trstram,Skingle,tskinglegs@e-recht24.de,Male,193.23.230.100,Maywood Austin Texas United States
1606,Margo,Vedeneev,mvedeneevgt@quantcast.com,Female,250.80.214.125,Crescent Oaks Waterbury Connecticut United States
1607,Lou,Chatin,lchatingu@godaddy.com,Female,134.31.230.122,Elka Las Vegas Nevada United States
1608,Sollie,Cino,scinogv@reddit.com,Male,27.46.206.124,Hanover Shreveport Louisiana United States
1609,Allison,Moughton,amoughtongw@etsy.com,Female,100.134.170.31,Cherokee Rochester New York United States
1610,Salomi,Duffan,sduffangx@digg.com,Female,84.10.22.253,Glacier Hill San Bernardino California United States
1611,Shawna,Popeley,spopeleygy@prweb.com,Female,247.242.53.254,Glendale Memphis Tennessee United States
1612,Silvie,Romaynes,sromaynesgz@naver.com,Female,183.111.55.27,Amoth Burbank California United States
1613,Marcellus,Querree,mquerreeh0@wordpress.org,Male,93.30.133.234,Rigney Tacoma Washington United States
1614,Shawn,Blackaby,sblackabyh1@opensource.org,Male,149.235.105.111,Shoshone Plano Texas United States
1615,Larina,Gierth,lgierthh2@buzzfeed.com,Female,91.207.167.118,Lakewood San Antonio Texas United States
1616,Dominique,Jerman,djermanh3@nih.gov,Female,158.37.57.66,Brickson Park Kansas City Kansas United States
1617,Nannette,Gashion,ngashionh4@alexa.com,Female,42.131.29.131,Coleman Austin Texas United States
1618,Rooney,Lamb-shine,rlambshineh5@bravesites.com,Male,182.177.48.24,Hermina Tacoma Washington United States
1619,Dew,Dobbie,ddobbieh6@unesco.org,Male,42.149.164.208,Pawling Wichita Falls Texas United States
1620,Hill,McDonagh,hmcdonaghh7@shareasale.com,Male,75.207.82.178,Sloan San Bernardino California United States
1621,Mathian,Feasey,mfeaseyh8@cbsnews.com,Male,118.107.101.40,Roth Gainesville Georgia United States
1622,Jillene,McCarle,jmccarleh9@skype.com,Female,179.25.28.239,Meadow Vale Tampa Florida United States
1623,Max,Duffield,mduffieldha@joomla.org,Female,137.86.156.121,Claremont Boston Massachusetts United States
1624,Milly,Itzakson,mitzaksonhb@amazon.de,Female,157.107.49.12,Clove Sacramento California United States
1625,Padgett,January,pjanuaryhc@squidoo.com,Male,29.160.213.221,Russell Austin Texas United States
1626,Taddeusz,Sedger,tsedgerhd@dailymail.co.uk,Male,230.222.85.136,School Washington District of Columbia United States
1627,Andrea,Tyce,atycehe@sitemeter.com,Female,54.226.38.175,Walton Albuquerque New Mexico United States
1628,Juieta,Swanger,jswangerhf@t.co,Female,40.131.239.88,Warbler Mobile Alabama United States
1629,Athena,Goude,agoudehg@istockphoto.com,Female,226.94.37.222,Tomscot Denver Colorado United States
1630,Kurt,O'Criane,kocrianehh@ft.com,Male,218.46.184.57,Hooker Salinas California United States
1631,Ravi,Basley,rbasleyhi@wordpress.com,Male,48.179.125.32,Prentice Pueblo Colorado United States
1632,Laurena,Pritty,lprittyhj@tripod.com,Female,237.255.17.243,Acker Nashville Tennessee United States
1633,Emmalynne,Bowfin,ebowfinhk@youtu.be,Female,201.207.219.54,Eggendart Birmingham Alabama United States
1634,Shelley,Bourget,sbourgethl@example.com,Male,126.133.207.158,Kensington Brockton Massachusetts United States
1635,Titos,Constantine,tconstantinehm@purevolume.com,Male,145.223.224.111,Debra Inglewood California United States
1636,Lorie,Sweynson,lsweynsonhn@zimbio.com,Female,99.31.10.184,Manitowish Ventura California United States
1637,Locke,Brownlie,lbrownlieho@newsvine.com,Male,126.189.113.104,Schiller San Francisco California United States
1638,Giselbert,Caudle,gcaudlehp@spotify.com,Male,16.72.90.136,Corben Kansas City Missouri United States
1639,Wallache,Tabard,wtabardhq@xrea.com,Male,25.87.224.189,Holy Cross Dayton Ohio United States
1640,Gerianne,Firle,gfirlehr@behance.net,Female,235.30.178.102,Sherman San Francisco California United States
1641,Steffi,Toffanini,stoffaninihs@upenn.edu,Female,29.219.118.148,Mcbride Savannah Georgia United States
1642,Elwood,Posselt,eposseltht@cnbc.com,Male,24.231.118.25,Moland Billings Montana United States
1643,Daisy,Helliwell,dhelliwellhu@technorati.com,Female,101.52.61.191,Arapahoe Cincinnati Ohio United States
1644,Kingston,Careswell,kcareswellhv@sphinn.com,Male,68.54.247.147,Canary Marietta Georgia United States
1645,Isidora,Dimitriev,idimitrievhw@ameblo.jp,Female,231.165.155.84,Dottie Indianapolis Indiana United States
1646,Otes,Fearnsides,ofearnsideshx@over-blog.com,Male,212.255.240.151,North Baltimore Maryland United States
1647,Bev,Summerson,bsummersonhy@wiley.com,Female,170.179.106.64,Mitchell Lake Charles Louisiana United States
1648,Che,Leindecker,cleindeckerhz@com.com,Male,82.151.26.254,Rockefeller Scottsdale Arizona United States
1649,Wenona,Rzehor,wrzehori0@biglobe.ne.jp,Female,125.165.165.238,Mifflin Springfield Massachusetts United States
1650,Sidney,Gosnall,sgosnalli1@constantcontact.com,Male,8.13.28.198,Hayes Clearwater Florida United States
1651,Maison,Flanne,mflannei2@1und1.de,Male,177.226.148.103,Sycamore Baltimore Maryland United States
1652,Opalina,Bettenay,obettenayi3@slideshare.net,Female,102.139.31.59,Sutteridge Washington District of Columbia United States
1653,Marietta,Ciani,mcianii4@comsenz.com,Male,78.84.67.84,Waubesa Apache Junction Arizona United States
1654,Noland,Cadore,ncadorei5@exblog.jp,Male,53.89.228.123,American Naples Florida United States
1655,Goran,Simoens,gsimoensi6@toplist.cz,Male,231.67.213.175,Packers Terre Haute Indiana United States
1656,Marcille,Spyby,mspybyi7@state.gov,Female,213.167.251.78,Ludington Sacramento California United States
1657,Joline,Cowser,jcowseri8@sphinn.com,Female,72.185.33.201,Cambridge Springfield Massachusetts United States
1658,Lark,Livingstone,llivingstonei9@wikipedia.org,Female,219.196.116.120,Waxwing College Station Texas United States
1659,Dewain,Noweak,dnoweakia@bloglovin.com,Male,6.117.246.138,Porter Houston Texas United States
1660,Burk,Hollows,bhollowsib@mozilla.com,Male,183.15.166.170,Ridgeview Chicago Illinois United States
1661,Kaye,Worviell,kworviellic@auda.org.au,Female,53.222.255.55,Orin New Orleans Louisiana United States
1662,Miner,Bortoletti,mbortolettiid@issuu.com,Male,166.24.138.216,Golden Leaf Helena Montana United States
1663,Tuckie,Yerby,tyerbyie@elpais.com,Male,119.59.127.60,Jackson Houston Texas United States
1664,Gerrie,Crighton,gcrightonif@oracle.com,Female,67.93.83.50,Cody Albuquerque New Mexico United States
1665,Alex,Frostdick,afrostdickig@homestead.com,Female,20.203.247.123,Corscot Kansas City Missouri United States
1666,Roz,Mulberry,rmulberryih@google.es,Female,35.232.123.65,Sachs Little Rock Arkansas United States
1667,Renaud,Carillo,rcarilloii@tuttocitta.it,Male,127.204.132.97,Heath Austin Texas United States
1668,Sibeal,Kamiyama,skamiyamaij@altervista.org,Female,50.213.106.186,Fordem Des Moines Iowa United States
1669,Theodosia,Anfrey,tanfreyik@meetup.com,Female,45.79.94.93,Vidon Oklahoma City Oklahoma United States
1670,Annice,Gaskoin,agaskoinil@google.ca,Female,120.180.244.1,Helena Missoula Montana United States
1671,Elisabet,Datte,edatteim@i2i.jp,Female,79.225.74.213,Thompson Los Angeles California United States
1672,Kala,Treppas,ktreppasin@digg.com,Female,200.175.31.15,Main Dallas Texas United States
1673,Berk,Bartolomeotti,bbartolomeottiio@admin.ch,Male,209.82.61.227,Sugar Milwaukee Wisconsin United States
1674,Etan,Carder,ecarderip@soundcloud.com,Male,167.221.16.232,6th Portland Oregon United States
1675,Guntar,Hartnell,ghartnelliq@mysql.com,Male,138.163.244.210,Spohn Orlando Florida United States
1676,Freddie,Shannon,fshannonir@go.com,Male,107.23.235.4,Mcbride Syracuse New York United States
1677,Moishe,Trout,mtroutis@rambler.ru,Male,21.99.4.210,Thierer Chicago Illinois United States
1678,Goldia,Bundey,gbundeyit@techcrunch.com,Female,150.100.252.129,Florence Dallas Texas United States
1679,George,Vinsen,gvinseniu@npr.org,Male,187.49.73.78,Bunting Longview Texas United States
1680,Devin,Howard,dhowardiv@merriam-webster.com,Female,75.236.153.3,Dovetail Lincoln Nebraska United States
1681,Cristiano,Drinkwater,cdrinkwateriw@devhub.com,Male,253.61.131.104,Blackbird Scottsdale Arizona United States
1682,Xymenes,Orsi,xorsiix@dailymotion.com,Male,199.220.173.23,Haas Houston Texas United States
1683,Bruno,Verner,bverneriy@globo.com,Male,219.168.127.132,Lawn Houston Texas United States
1684,Miller,Keeping,mkeepingiz@about.com,Male,140.136.23.179,Crowley Los Angeles California United States
1685,Petey,Mannix,pmannixj0@scribd.com,Male,155.204.229.197,Washington Roanoke Virginia United States
1686,Neill,Ensten,nenstenj1@yahoo.com,Male,2.73.83.16,Quincy Washington District of Columbia United States
1687,Phillipe,Elletson,pelletsonj2@tinyurl.com,Male,153.237.94.147,Waubesa Champaign Illinois United States
1688,Honoria,Rennenbach,hrennenbachj3@shop-pro.jp,Female,87.193.101.87,Randy Worcester Massachusetts United States
1689,Rodrique,Zavattari,rzavattarij4@ustream.tv,Male,98.25.49.32,Atwood Kansas City Missouri United States
1690,Kylie,Jarrold,kjarroldj5@columbia.edu,Female,176.105.80.208,Coolidge Gainesville Florida United States
1691,Kakalina,Crosfield,kcrosfieldj6@economist.com,Female,109.123.182.32,Hermina Dallas Texas United States
1692,Tamiko,Penwarden,tpenwardenj7@wp.com,Female,253.109.84.29,Walton Detroit Michigan United States
1693,Shellysheldon,Johansson,sjohanssonj8@mozilla.org,Male,223.149.206.99,Express Cincinnati Ohio United States
1694,Kylie,Sinclaire,ksinclairej9@springer.com,Male,133.21.133.181,Glacier Hill Palatine Illinois United States
1695,Mary,Moseley,mmoseleyja@merriam-webster.com,Female,87.56.35.251,Knutson Irvine California United States
1696,Noak,Medgewick,nmedgewickjb@nsw.gov.au,Male,130.36.23.20,Shasta Mobile Alabama United States
1697,Yoshi,Pasticznyk,ypasticznykjc@goodreads.com,Female,18.238.76.68,Gale San Diego California United States
1698,Edith,Marmon,emarmonjd@miibeian.gov.cn,Female,156.235.220.85,Ronald Regan El Paso Texas United States
1699,Omero,Rous,orousje@jiathis.com,Male,88.87.253.90,Goodland New Haven Connecticut United States
1700,Val,Leport,vleportjf@bbc.co.uk,Female,164.249.0.9,Bayside Saint Paul Minnesota United States
1701,Tessa,Willoughley,twilloughleyjg@reddit.com,Female,83.88.59.252,Magdeline Provo Utah United States
1702,Irina,Wynch,iwynchjh@slate.com,Female,169.170.245.147,Bultman Bloomington Indiana United States
1703,Constancia,Breston,cbrestonji@businesswire.com,Female,17.91.221.128,Forest Honolulu Hawaii United States
1704,Augustina,Maude,amaudejj@hugedomains.com,Female,155.112.244.174,Garrison San Diego California United States
1705,Merline,Jalland,mjallandjk@mayoclinic.com,Female,48.29.80.54,Monica Washington District of Columbia United States
1706,Berkley,Kauble,bkaublejl@columbia.edu,Male,246.215.224.30,Londonderry El Paso Texas United States
1707,Arnold,Crayk,acraykjm@fotki.com,Male,97.30.57.163,Mockingbird Syracuse New York United States
1708,Falito,Bennetts,fbennettsjn@guardian.co.uk,Male,176.45.204.42,Glendale New Orleans Louisiana United States
1709,Gusty,Deny,gdenyjo@unblog.fr,Female,144.57.88.191,Loeprich Syracuse New York United States
1710,Cirillo,Blaney,cblaneyjp@simplemachines.org,Male,66.90.138.31,Cody Shreveport Louisiana United States
1711,Dyane,Putton,dputtonjq@yolasite.com,Female,0.160.137.228,Main Detroit Michigan United States
1712,Kai,Muddimer,kmuddimerjr@sohu.com,Female,28.247.204.219,Prairieview Carol Stream Illinois United States
1713,Jamima,Reinbech,jreinbechjs@guardian.co.uk,Female,196.194.238.191,Nelson Colorado Springs Colorado United States
1714,Edan,Keelan,ekeelanjt@facebook.com,Male,172.25.76.55,Goodland Aurora Colorado United States
1715,Duane,Freegard,dfreegardju@tamu.edu,Male,238.52.159.255,Holy Cross Las Vegas Nevada United States
1716,Frederik,Mangan,fmanganjv@whitehouse.gov,Male,8.105.160.46,Buell Los Angeles California United States
1717,Truman,Clyde,tclydejw@archive.org,Male,97.74.106.137,Meadow Valley Albany New York United States
1718,Dorie,Lovering,dloveringjx@economist.com,Female,17.30.174.90,Gateway Miami Florida United States
1719,Rosalyn,Payze,rpayzejy@sina.com.cn,Female,183.101.155.164,1st North Las Vegas Nevada United States
1720,Patsy,Donaldson,pdonaldsonjz@facebook.com,Male,235.169.10.167,Springs Detroit Michigan United States
1721,Darrel,Paridge,dparidgek0@flavors.me,Male,96.162.155.198,Colorado Bakersfield California United States
1722,Saxon,Cushe,scushek1@icio.us,Male,227.255.133.241,American Ash Sacramento California United States
1723,Isacco,Wallsam,iwallsamk2@princeton.edu,Male,106.70.59.107,Summer Ridge Tacoma Washington United States
1724,Kellina,Gauson,kgausonk3@sohu.com,Female,90.198.28.73,Dwight Corpus Christi Texas United States
1725,Saleem,Axelby,saxelbyk4@example.com,Male,26.75.124.62,Ruskin Phoenix Arizona United States
1726,Lucila,Tawse,ltawsek5@cocolog-nifty.com,Female,25.9.206.89,Lotheville Marietta Georgia United States
1727,Ernie,Starkings,estarkingsk6@ifeng.com,Male,11.84.212.32,Burrows Green Bay Wisconsin United States
1728,Nickey,Dreelan,ndreelank7@acquirethisname.com,Male,88.2.211.142,Village Shreveport Louisiana United States
1729,Nonah,Goskar,ngoskark8@naver.com,Female,184.136.78.92,Prentice Saint Paul Minnesota United States
1730,Farris,Impey,fimpeyk9@etsy.com,Male,109.17.17.215,Kensington Worcester Massachusetts United States
1731,Susann,Eshmade,seshmadeka@virginia.edu,Female,235.223.100.18,Morning Biloxi Mississippi United States
1732,Iorgos,Jacobs,ijacobskb@omniture.com,Male,199.218.254.143,Crowley Colorado Springs Colorado United States
1733,Ogdan,Dunkerly,odunkerlykc@walmart.com,Male,236.154.116.72,Sachtjen Great Neck New York United States
1734,Hayes,Coling,hcolingkd@last.fm,Male,157.188.65.70,Cambridge Washington District of Columbia United States
1735,Rowe,Kaes,rkaeske@themeforest.net,Female,123.77.158.176,Pawling Fort Wayne Indiana United States
1736,Davida,Cleaves,dcleaveskf@unesco.org,Female,206.211.151.32,Scoville West Palm Beach Florida United States
1737,Salim,Broddle,sbroddlekg@bluehost.com,Male,176.31.118.146,Lerdahl New York City New York United States
